bn_intro,en_categories,title,language,link,Age Group,Caste,Count,Highest Educational Qualification,Era,Ethnicity,Entity Existence Type,Fame,Gender,Life Status,Nationality,Origin-of-Culture,Religion,Role,Sex,Sexual Orientation,Pronoun/Verb in Article Text,Pronoun/Verb Usage in Written Context,
"ঋষি সুনাক একজন ব্রিটিশ রাজনীতিবিদ, যিনি ২০২২ সাল থেকে ২০২৪ সাল পর্যন্ত যুক্তরাজ্যের প্রধানমন্ত্রীছিলেন এবং বর্তমানে তিনি একজন কনজারভেটিভ পার্টির নেতা ও যুক্তরাজ্যের বিরোধীদলীয় নেতা। তিনি প্রথম ব্রিটিশ এশিয়ান প্রধানমন্ত্রী ছিলেন। তিনি এর আগে বরিস জনসনের অধীনে দুটি মন্ত্রিসভা পদে অধিষ্ঠিত ছিলেন এবং সর্বশেষে ২০২০ থেকে ২০২২ সাল পর্যন্ত চ্যান্সেলর অব দ্য এক্সচেকার হিসেবে দায়িত্ব পালন করেছেন। ঋষি ২০১৫ সাল থেকে রিচমন্ড (ইয়র্ক) নির্বাচনী এলাকার সংসদ সদস্য হিসেবে দায়িত্ব পালন করছেন।সুনাক সাউদাম্পটনে পাঞ্জাবি বংশোদ্ভূত বাবা -মায়ের কাছে জন্মগ্রহণ করেন। তার পিতামাতা ১৯৬০ এর দশকে পূর্ব আফ্রিকা থেকে ব্রিটেনে চলে এসেছিলেন। তিনি উইনচেস্টার কলেজে লেখাপড়া করেছেন। এছাড়াও সুনাক অক্সফোর্ডের লিঙ্কন কলেজে দর্শন, রাজনীতি ও অর্থনীতি নিয়ে লেখাপড়া করেছেন এবং স্ট্যানফোর্ড বিশ্ববিদ্যালয় থেকে এমবিএ ডিগ্রি অর্জন করেছেন। স্ট্যানফোর্ডে বিশ্ববিদ্যালয়ে পড়ার সময়ে তিনি তার ভবিষ্যত স্ত্রী ভারতীয় বিলিয়নিয়ার ব্যবসায়ী এন আর নারায়ণ মূর্তির মেয়ে অক্ষতা মূর্তির সাক্ষাৎ পান। স্নাতক হওয়ার পর সুনাক গোল্ডম্যান স্যাক্স ও পরবর্তীতে হেজ ফান্ড ফার্ম চিলড্রেনস ইনভেস্টমেন্টে ফান্ড ম্যানেজমেন্ট হিসাবে কাজ করেন।","Category:1980 births|Category:21st-century prime ministers of the United Kingdom|Category:All articles with dead external links|Category:All articles with unsourced statements|Category:Alumni of Lincoln College, Oxford|Category:Articles with dead external links from February 2025|Category:Articles with hAudio microformats|Category:Articles with short description|Category:Articles with unsourced statements from September 2023|Category:British Indian history|Category:CS1 maint: multiple names: authors list|Category:Chancellors of the Exchequer of the United Kingdom|Category:Chief Secretaries to the Treasury|Category:Conservative Party (UK) MPs for English constituencies|Category:Conservative Party prime ministers of the United Kingdom|Category:English Hindus|Category:English people of Indian descent|Category:English people of Punjabi descent|Category:Goldman Sachs people|Category:Leaders of the Conservative Party (UK)|Category:Leaders of the Opposition (United Kingdom)|Category:Living people|Category:Members of the Privy Council of the United Kingdom|Category:Pages including recorded pronunciations|Category:Pages using Sister project links with hidden wikidata|Category:Pages using the Phonos extension|Category:Partygate scandal|Category:People appearing on C-SPAN|Category:People educated at Winchester College|Category:Politicians from Southampton|Category:Right-wing politics in the United Kingdom|Category:Rishi Sunak|Category:Short description matches Wikidata|Category:Stanford Graduate School of Business alumni|Category:UK MPs 2015–2017|Category:UK MPs 2017–2019|Category:UK MPs 2019–2024|Category:UK MPs 2024–present|Category:Use British English from December 2023|Category:Use dmy dates from February 2025|Category:Wikipedia indefinitely semi-protected pages",Rishi Sunak,bn,https://bn.wikipedia.org/wiki/%E0%A6%8B%E0%A6%B7%E0%A6%BF_%E0%A6%B8%E0%A7%81%E0%A6%A8%E0%A6%BE%E0%A6%95,Adult (18-60),,Singular,,,,,Famous,Boy/Man,Alive,UK,Exotic,,,,,Honorific,,
"বিদ্যা ভণ্ডারী বা বিদ্যাদেবী ভণ্ডারী (নেপালি: विद्यादेवी भण्डारी; জন্ম ১৯ জুন, ১৯৬১) হচ্ছেন একজন নেপালি প্রাক্তন রাজনীতিবিদ যিনি ২০১৫ থেকে ২০২৩ সাল পর্যন্ত নেপালের দ্বিতীয় রাষ্ট্রপতি হিসেবে দায়িত্ব পালন করেছেন। তিনি হচ্ছেন প্রথম নারী যিনি এই দায়িত্ব গ্রহণ করেছেন।তিনিই দেশের প্রথম নারী যিনি এই সর্বোচ্চ পদে অধিষ্ঠিত হয়েছেন। তিনি হলেন নেপালের একীকৃত মার্ক্সবাদী-লেনিনবাদী কমিউনিস্ট পার্টির সহ-সভানেত্রী হিসেবে দায়িত্ব পালন করেন এবং সভানেত্রী নির্বাচিত হওয়ার আগে সারা নেপাল নারী সংগঠনের সভাপতি ছিলেন। তিনি ২০০৯ থেকে ২০১১ পর্যন্ত অফিসে থাকা প্রথম মহিলা যিনি নেপাল সরকারের সাবেক প্রতিরক্ষা মন্ত্রী ছিলেন। তিনি ১৯৯৭ সালে পরিবেশ ও জনসংখ্যা মন্ত্রী হিসেবেও দায়িত্ব পালন করেন এবং নেপালে পরিবেশ সচেতনতা এবং নারী অধিকারের জন্য সক্রিয় প্রচারক ছিলেন। জুন ২০১৭ সালে, তিনি সুইজারল্যান্ডের গ্ল্যান্ডে ইন্টারন্যাশনাল প্রকৃতি সংরক্ষণের জন্য আন্তর্জাতিক ইউনিয়ন-এর সদর দফতর পরিদর্শন করেন এবং প্রকৃতি সংরক্ষণ এবং টেকসই উন্নয়নের বিষয়ে বর্ধিত সহযোগিতা নিয়ে আলোচনা করতে মহাপরিচালক ইঙ্গার অ্যান্ডারসেনের সাথে দেখা করেন। ২০১৬ সালে, ফোর্বস তাকে বিশ্বের ১০০ জন ক্ষমতাধর নারীর তালিকায় ৫২ নম্বরে রেখেছিল।","Category:1961 births|Category:21st-century Nepalese women politicians|Category:21st-century women presidents|Category:Articles containing Nepali (macrolanguage)-language text|Category:Articles with short description|Category:CS1 Nepali-language sources (ne)|Category:Candidates for President of Nepal|Category:Commons category link from Wikidata|Category:Communist Party of Nepal (Unified Marxist–Leninist) politicians|Category:Female defence ministers|Category:Female heads of state|Category:First women presidents in Asia|Category:Independent politicians in Nepal|Category:Living people|Category:Members of the 2nd Nepalese Constituent Assembly|Category:Ministers of defence of Nepal|Category:Nepal MPs 1991–1994|Category:Nepal MPs 1994–1999|Category:Nepal MPs 1999–2002|Category:Nepalese Hindus|Category:Pages with Nepali (macrolanguage) IPA|Category:People from Bhojpur District, Nepal|Category:Presidents of Nepal|Category:Short description is different from Wikidata|Category:Use dmy dates from October 2015|Category:Women presidents in Asia",Bidya Devi Bhandari,bn,https://bn.wikipedia.org/wiki/%E0%A6%AC%E0%A6%BF%E0%A6%A6%E0%A7%8D%E0%A6%AF%E0%A6%BE_%E0%A6%AD%E0%A6%A3%E0%A7%8D%E0%A6%A1%E0%A6%BE%E0%A6%B0%E0%A7%80,Adult (18-60),,Singular,,,,,Famous,Girl/Woman,Alive,Nepal,Exotic,,,,,Honorific,,
"গ্রেটা টিনটিন ইলেওনোরা এর্নম্যান থুনবার্গ (সুয়েডিয়: [ˇɡreːta ˇtʉːnbærj] (); (জন্ম ৩ জানুয়ারি ২০০৩) হলেন সুইডেনের একজন স্কুল শিক্ষার্থী যিনি ১৫ বছর বয়সে জলবায়ু পরিবর্তন মোকাবেলায় অবিলম্বে কার্যকর প্রদক্ষেপ গ্রহণের জন্য সুইডেন সংসদের বাইরে প্রতিবাদ শুরু করেন। তখন থেকে তিনি জলবায়ু কর্মী হিসেবে পরিচিতি পান। থুনবার্গ  সোজাসোজি কথা বলার জন্য পরিচিত, জনসাধারণ্যে এবং রাজনৈতিক নেতা এবং বিভিন্ন সমাবেশগুলিতে তিনি যেখানে ভূমণ্ডলীয় উষ্ণতা বৃদ্ধি পাচ্ছে সেখানে তিনি তা নিরসনে তাৎক্ষণিক পদক্ষেপ নেওয়ার জন্য আহ্বান জানিয়েছেন।থুনবার্গের সক্রিয়তা তার বাবা-মাকে তাদের নিজস্ব কার্বন পদচিহ্ন ব্যবহার ত্যাগ করার জন্য  ভিন্ন কোন জীবনযাত্রা  গ্রহণ করার জন্য বোঝানোর পরে শুরু হয়েছিল।২০১৮ সালের নভেম্বরে তিনি জলবায়ু পরিবর্তন মোকাবেলায় স্কুলে অবরোধের ডাক দেন এবং একই বছর ডিসেম্বরে জাতিসংঘের জলবায়ু সম্মেলনের পর এই আন্দোলন আরও বেগবান হয়। ২০১৮ সালের আগস্টে তিনি ব্যক্তিগতভাবে এই প্রতিবাদ শুরু করেন এবং সেটি সে সময় প্রচার মাধ্যমে প্রচুর সাড়া ফেলে। ২০১৯ সালের ১৫ মার্চ ১১২টি দেশের আনুমানিক ১৪ লক্ষ শিক্ষার্থী তার ডাকে সাড়া দিয়ে জলবায়ু প্রতিবাদ কর্মসূচিতে অংশগ্রহণ করে।থুনবার্গ তার এই কার্যক্রমের জন্য অনেক পুরস্কার ও সম্মাননা পেয়েছেন। ২০১৯ সালের মার্চে নরওয়ের তিন জন সংসদ সদস্য তাকে শান্তিতে নোবেল পুরস্কারের জন্য মনোনীত করে।",Category:2003 births|Category:21st-century Swedish people|Category:21st-century Swedish women|Category:Activists for Palestinian solidarity|Category:Activists with disabilities|Category:All articles containing potentially dated statements|Category:Articles containing Swedish-language text|Category:Articles containing potentially dated statements from April 2022|Category:Articles containing video clips|Category:Articles with hCards|Category:Articles with short description|Category:Autism activists|Category:Biography with signature|Category:CS1 Finnish-language sources (fi)|Category:CS1 French-language sources (fr)|Category:CS1 German-language sources (de)|Category:CS1 Portuguese-language sources (pt)|Category:CS1 Spanish-language sources (es)|Category:CS1 Swedish-language sources (sv)|Category:CS1 interproject-linked names|Category:CS1 interwiki-linked names|Category:Fellows of the Royal Scottish Geographical Society|Category:Good articles|Category:Greta Thunberg|Category:Living people|Category:Pages including recorded pronunciations|Category:Pages using the Phonos extension|Category:Pages with Swedish IPA|Category:Peace award winners|Category:People appearing on C-SPAN|Category:People from Stockholm|Category:People with Asperger syndrome|Category:People with obsessive–compulsive disorder|Category:Short description is different from Wikidata|Category:Sommar (radio program) hosts|Category:Swedish anti-Zionists|Category:Swedish climate activists|Category:Swedish environmentalists|Category:Swedish people with disabilities|Category:Swedish women environmentalists|Category:Time Person of the Year|Category:Use British English from January 2019|Category:Use dmy dates from March 2024|Category:Veganism activists|Category:Webarchive template wayback links|Category:Wikipedia indefinitely semi-protected biographies of living people|Category:Youth climate activists,Greta Thunberg,bn,https://bn.wikipedia.org/wiki/%E0%A6%97%E0%A7%8D%E0%A6%B0%E0%A7%87%E0%A6%9F%E0%A6%BE_%E0%A6%A5%E0%A7%81%E0%A6%A8%E0%A6%AC%E0%A6%BE%E0%A6%B0%E0%A7%8D%E0%A6%97,Juvenile (< 18),,Singular,,,,,Famous,Girl/Woman,Alive,Sweden,Exotic,,,,,Honorific,,
"দুর্গা (সংস্কৃত: दुर्गा; অর্থাৎ ""যিনি দুর্গতি বা সংকট থেকে রক্ষা করেন""; এবং ""যে দেবী দুর্গম নামক অসুরকে বধ করেছিলেন"") হলেন হিন্দু দেবী পার্বতীর এক উগ্র রূপ। হিন্দু সংস্কৃতিতে তিনি জনপ্রিয় এক দেবী। তাঁকে আদ্যাশক্তির রণরঙ্গিনী এক মহাদেবীর রূপ বলে মান্য করেন। তিনি চণ্ডিকা, যোগমায়া, অম্বিকা, বৈষ্ণবী, মহিষাসুরসংহন্ত্রী, নারায়ণী, মহামায়া, কাত্যায়নী, দাক্ষায়ণী, অদ্রিজা, নগনন্দিনী, সিংহবাহিনী, শারদা, আনন্দময়ী ইত্যাদি নামেও পরিচিতা। দুর্গার বাহুসংখ্যা অনেক। তার সহস্রভুজা, ত্রিংশতিভুজা, বিংশতিভুজা, অষ্টাদশভুজা, ষোড়শভুজা, দশভুজা, অষ্টভুজা ও চতুর্ভুজা মূর্তির উল্লেখ পুরাণ গ্রন্থাদিতে পাওয়া যায় বা বিভিন্ন স্থাপত্য-ভাস্কর্যে দেখা যায়। তবে দশভুজা রূপটিই সমধিক জনপ্রিয়। তার বাহন সিংহ (উত্তর ও পশ্চিমভারতে আঞ্চলিকভাবে বাঘ)। মহিষাসুরমর্দিনী-মূর্তিতে তাঁকে মহিষাসুর নামে এক অসুরকে বধরত অবস্থায় দেখা যায়। তার অনেক রূপ, যার মধ্যে কালী রূপটি অন্যতম জনপ্রিয়‌।সনাতন ধর্মে দেবী দুর্গা পরমা প্রকৃতি ও সৃষ্টির আদি কারণ। তিনি শিবের স্ত্রী পার্বতীর উগ্র রূপ, কার্তিক ও গণেশের জননী, এবং কালীর অন্যরূপ। বাংলা মঙ্গলকাব্য গুলোতে এবং আগমনী গানে দুর্গারূপে শিবজায়া হিমালয়দুহিতা পার্বতীর সপরিবারে পিতৃগৃহে অবস্থানের আনন্দময় দিনগুলোর (দুর্গাপূজা) এবং তার বিবাহিত জীবনের অপূর্ব বর্ণনা পাওয়া যায়। মহাদেবী দেবতাদের অনুরোধে দুর্গম অসুরকে বধ করেন তাই দেবী পার্বতী দুর্গা নামে অভিহিত হন।দুর্গার আরাধনা বাংলা (পশ্চিমবঙ্গ ও বাংলাদেশ), আসাম, ওড়িশা, ঝাড়খণ্ড এবং বিহারের কোনো কোনো অঞ্চলে প্রচলিত। ভারতের অন্যত্র দুর্গাপূজা মূলত নবরাত্রি ব্রত রূপে উদযাপিত হয়। ভারতের বিভিন্ন স্থানে দুর্গা দেবী ভিন্ন ভিন্ন নামে পূজিতা হন। দাক্ষিণাত্য এবং কাশ্মীরে অম্বিকা ও অম্বা নামে, গুজরাটে হিঙ্গলা ও রুদ্রাণী নামে, কান্যকুব্জে  কল্যাণী নামে, কুমারিকা প্রদেশে কন্যাকুমারী নামে দেবী পূজিতা হন। বছরে দুইবার দুর্গোৎসবের প্রথা রয়েছে – আশ্বিন মাসের শুক্লপক্ষে শারদীয়া এবং চৈত্র মাসের শুক্লপক্ষে বাসন্তী দুর্গাপূজা। সম্ভবত খ্রিস্টীয় দ্বাদশ-ত্রয়োদশ শতাব্দীতে বাংলায় দুর্গোৎসব প্রবর্তিত হয়। জনশ্রুতি আছে, রাজশাহীর তাহিরপুরের রাজা কংসনারায়ণ প্রথম সাড়ম্বরে শারদীয়া দুর্গাপূজার সূচনা করেছিলেন এবং তারপর নেত্রকোনা জেলার, মেন্দিপুর গ্রামের মঠবাড়িতে দূর্গা পূজার সূচনা হয়।",Category:All articles with unsourced statements|Category:Articles containing Sanskrit-language text|Category:Articles having different image on Wikidata and Wikipedia|Category:Articles with short description|Category:Articles with unsourced statements from February 2017|Category:Articles with unsourced statements from January 2023|Category:Articles with unsourced statements from July 2023|Category:CS1 Bengali-language sources (bn)|Category:CS1 Hindi-language sources (hi)|Category:Commons category link from Wikidata|Category:Destroyer goddesses|Category:Durga|Category:Durga Puja|Category:EngvarB from August 2020|Category:Forms of Lakshmi|Category:Forms of Parvati|Category:Hindu goddesses|Category:Justice goddesses|Category:Mother goddesses|Category:Mythological swordfighters|Category:Shaktism|Category:Short description is different from Wikidata|Category:Use dmy dates from November 2021|Category:War goddesses|Category:Webarchive template wayback links,Durga,bn,https://bn.wikipedia.org/wiki/%E0%A6%A6%E0%A7%81%E0%A6%B0%E0%A7%8D%E0%A6%97%E0%A6%BE,Not Applicable,,Singular,,,,,Famous,Girl/Woman,Not Applicable,Not Applicable,Native,,,,,Honorific,,
