,jv_intro,en_categories,title,language,link
67,"Oprah Winfrey kang jeneng asline Oprah Gail Winfrey minangka tokoh kang kawéntar ing Amérikah Sarékat. Dhèwèké iku présénter, prodhuser lan aktris.. Oprah lair ing Kosciusko Mississippi tanggal (lair  29 Januari 1954; umur 71 taun). Dhèwèké duwé acara kang kawéntar banget judhulé Oprah Winfrey Show. Dhèwèké tau dadi kurban kekerasan séksual déning kulawarga lan kanca-kancané ibuné, Vernita. Terus dhèwèké pindhah ing Nashville, urip karo bapake, Vernon. Vernon iku tukang cukur rambut lan duwé bisnis. Oprah lumebu ing Tennessee State University ing taun 1971 lan wiwit kerja ing radio lan tv ing Nashville.Oprah pindhah ing Baltimore ing taun 1976. Dhèwèké mandhu acara tv People Are Talking, acara iki dadi kondhang, Oprah tetep nggawa acara iki nganti 8 taun. Sawisé iku, dhèwèké kerja ing stasiun TV Chicago lan nggawa acara A.M. Chicago. Dhèwèké tau main ing filem The Color Purple ing taun 1985, filem iku gawéyané Steven Spielberg lan Oprah dinominasikna ing Acadey Award dadi aktris pendhukung terbaik.Ing taun 1986, Oprah ngluncurna program TV Oprah Winfrey Show lan olih kepemilikan program ABC. Dhèwèké ngendhalikna perusahaan prodhuksi, Harpo Production. Ing taun 1989, Oprah lan Hapro Production gawé serial TV The Woen of Brewster Place.","Category:1954 births|Category:20th-century African-American actresses|Category:20th-century African-American businesspeople|Category:20th-century African-American women writers|Category:20th-century African-American writers|Category:20th-century American actresses|Category:20th-century American businesspeople|Category:20th-century American businesswomen|Category:20th-century American journalists|Category:20th-century American non-fiction writers|Category:20th-century American women journalists|Category:20th-century American women writers|Category:21st-century African-American actresses|Category:21st-century African-American businesspeople|Category:21st-century African-American women writers|Category:21st-century African-American writers|Category:21st-century American actresses|Category:21st-century American businesspeople|Category:21st-century American businesswomen|Category:21st-century American journalists|Category:21st-century American non-fiction writers|Category:21st-century American philanthropists|Category:21st-century American women journalists|Category:21st-century American women philanthropists|Category:21st-century American women writers|Category:Actresses from Chicago|Category:Actresses from Mississippi|Category:African-American billionaires|Category:African-American business executives|Category:African-American company founders|Category:African-American film producers|Category:African-American television personalities|Category:African-American television producers|Category:African-American television talk show hosts|Category:African-American women in business|Category:All BLP articles lacking sources|Category:All Wikipedia articles written in American English|Category:All articles with incomplete citations|Category:American billionaires|Category:American chief executives in the mass media industry|Category:American film producers|Category:American magazine publishers (people)|Category:American mass media owners|Category:American motivational speakers|Category:American motivational writers|Category:American people of Kpelle descent|Category:American radio producers|Category:American self-help writers|Category:American television actresses|Category:American television talk show hosts|Category:American voice actresses|Category:American web producers|Category:American women chief executives|Category:American women company founders|Category:American women film producers|Category:American women motivational speakers|Category:American women non-fiction writers|Category:American women radio producers|Category:American women television hosts|Category:American women television producers|Category:Articles tagged with the inline citation overkill template from September 2023|Category:Articles with Open Library links|Category:Articles with hCards|Category:Articles with incomplete citations from December 2023|Category:Articles with short description|Category:BLP articles lacking sources from January 2018|Category:Biography with signature|Category:Businesspeople from Chicago|Category:Businesspeople from Mississippi|Category:Cecil B. DeMille Award Golden Globe winners|Category:Citation overkill|Category:Daytime Emmy Award for Outstanding Talk Show Host winners|Category:Female billionaires|Category:Founders of academic institutions|Category:Harv and Sfn no-target errors|Category:Illinois independents|Category:International Emmy Founders Award winners|Category:Jean Hersholt Humanitarian Award winners|Category:Journalists from Illinois|Category:Journalists from Mississippi|Category:Kennedy Center honorees|Category:Living people|Category:Miss Black America delegates|Category:Oprah Winfrey|Category:Pages using Sister project links with hidden wikidata|Category:Pages using Sister project links with wikidata namespace mismatch|Category:Peabody Award winners|Category:People appearing on C-SPAN|Category:People from Kosciusko, Mississippi|Category:Presidential Medal of Freedom recipients|Category:Primetime Emmy Award winners|Category:Short description is different from Wikidata|Category:Television anchors from Baltimore|Category:Television anchors from Chicago|Category:Television producers from Illinois|Category:Television show creators|Category:Tennessee State University alumni|Category:Use American English from March 2021|Category:Use mdy dates from March 2022|Category:Webarchive template wayback links|Category:Wikipedia articles needing page number citations from January 2017|Category:Wikipedia indefinitely move-protected pages|Category:Wikipedia indefinitely semi-protected biographies of living people|Category:Women motivational writers|Category:Writers from Chicago|Category:Writers from Mississippi",Oprah Winfrey,jv,https://jv.wikipedia.org/wiki/Oprah_Winfrey
68,"Nicolás Maduro Moros (pangucap cara Spanyol: [nikoˈlaz maˈðuɾo ˈmoɾos]; lair  23 Novèmber 1962; umur 62 taun) iku pulitisi Venezuela sing saiki dadi Présidhèn Venezuela. Sadurungé dhèwèké njabat minangka Wakil Présidhèn Venezuela lan Mantri Manca Nagara ing sangisoré Présidhèn Hugo Chavez.Sawisé patiné Chávez tanggal 5 Marret 2013, Maduro dianggep mengku wewenang lan tanggung jawab présidhèn. Sawijining pamilihan mirunggan kang dianakaké tanggal 14 April ing taun sing padha kanggo milih présidhèn anyar, Maduro menang kanthi slisih ketat minangka calon saka Parté Persatuan Sosialis; dhèwèké kanthi resmi dilantik tanggal 19 April 2013. Lawan mligi ing pamilihan ya iku Gubernur Miranda, Henrique Capriles.",Category:1962 births|Category:21st-century Venezuelan politicians|Category:All Wikipedia articles in need of updating|Category:All articles to be expanded|Category:All articles with empty sections|Category:All articles with specifically marked weasel-worded phrases|Category:All articles with unsourced statements|Category:Anti-Americanism|Category:Anti-Zionism in South America|Category:Anti-imperialism in South America|Category:Articles containing video clips|Category:Articles to be expanded from July 2024|Category:Articles with Spanish-language sources (es)|Category:Articles with empty sections from July 2024|Category:Articles with short description|Category:Articles with specifically marked weasel-worded phrases from January 2021|Category:Articles with specifically marked weasel-worded phrases from May 2021|Category:Articles with unsourced statements from January 2021|Category:Articles with unsourced statements from January 2022|Category:Articles with unsourced statements from June 2019|Category:Articles with unsourced statements from March 2020|Category:Bus drivers|Category:CS1 Brazilian Portuguese-language sources (pt-br)|Category:CS1 European Spanish-language sources (es-es)|Category:CS1 French-language sources (fr)|Category:CS1 German-language sources (de)|Category:CS1 Spanish-language sources (es)|Category:Far-left politics in Venezuela|Category:Fifth Republic Movement politicians|Category:Fugitives wanted by the United States|Category:Living people|Category:Maduro family|Category:Members of the Venezuelan Chamber of Deputies|Category:Members of the Venezuelan Constituent Assembly of 1999|Category:Ministers of foreign affairs of Venezuela|Category:Nicolás Maduro|Category:Pages including recorded pronunciations|Category:Pages using Sister project links with hidden wikidata|Category:Pages using multiple image with auto scaled images|Category:Pages using the Phonos extension|Category:Pages with Spanish IPA|Category:People of the Crisis in Venezuela|Category:Politicians from Caracas|Category:Presidents pro tempore of the Union of South American Nations|Category:Secretaries-general of the Non-Aligned Movement|Category:Short description is different from Wikidata|Category:Speakers of the National Assembly (Venezuela)|Category:Specially Designated Nationals and Blocked Persons List|Category:United Socialist Party of Venezuela politicians|Category:Use dmy dates from December 2024|Category:Venezuelan nationalists|Category:Venezuelan people of Colombian descent|Category:Venezuelan people of Jewish descent|Category:Venezuelan people of Spanish descent|Category:Venezuelan politicians convicted of corruption|Category:Venezuelan trade union leaders|Category:Vice presidents of Venezuela|Category:Webarchive template wayback links|Category:Wikipedia articles in need of updating from January 2023|Category:Wikipedia articles needing clarification from January 2021|Category:Wikipedia articles needing clarification from March 2020|Category:Wikipedia pages semi-protected against vandalism,Nicolás Maduro,jv,https://jv.wikipedia.org/wiki/Nicol%C3%A1s_Maduro
69,"Charlize Theron (lair 7 Agustus 1975 ing Benoni, Gauteng) iku aktris pamenang Academy Awards lan mantan modhèl asal saka Afrika Kidul.","Category:1975 births|Category:20th-century American actresses|Category:20th-century South African actresses|Category:21st-century American actresses|Category:21st-century South African actresses|Category:Afrikaner people|Category:All Wikipedia articles written in South African English|Category:All articles with a promotional tone|Category:American abortion-rights activists|Category:American female models|Category:American film actresses|Category:American film producers|Category:American people of Afrikaner descent|Category:American people of Dutch descent|Category:American people of French descent|Category:American people of German descent|Category:American television actresses|Category:American voice actresses|Category:American women's rights activists|Category:American women film producers|Category:Articles with a promotional tone from December 2023|Category:Articles with hCards|Category:Articles with short description|Category:Best Actress Academy Award winners|Category:Best Drama Actress Golden Globe (film) winners|Category:CS1 Italian-language sources (it)|Category:Charlize Theron|Category:Independent Spirit Award for Best Female Lead winners|Category:Living people|Category:Naturalized citizens of the United States|Category:Outstanding Performance by a Female Actor in a Leading Role Screen Actors Guild Award winners|Category:Pages using Sister project links with hidden wikidata|Category:Pages using Sister project links with wikidata namespace mismatch|Category:Pages with Afrikaans IPA|Category:People from Benoni, South Africa|Category:Short description is different from Wikidata|Category:Silver Bear for Best Actress winners|Category:South African HIV/AIDS activists|Category:South African emigrants to the United States|Category:South African female models|Category:South African film actresses|Category:South African film producers|Category:South African people of Dutch descent|Category:South African people of French descent|Category:South African people of German descent|Category:South African television actresses|Category:South African voice actresses|Category:South African women's rights activists|Category:South African women activists|Category:TCMDb name template using non-numeric ID from Wikidata|Category:United Nations Messengers of Peace|Category:Use South African English from April 2021|Category:Use dmy dates from September 2021|Category:Webarchive template wayback links|Category:Wikipedia indefinitely move-protected pages|Category:Wikipedia indefinitely semi-protected pages",Charlize Theron,jv,https://jv.wikipedia.org/wiki/Charlize_Theron
70,"Megan Denise Fox (lair ing Oak Ridge, Tennessee, Amérikah Sarékat, 16 Mèi 1986; umur 38 taun) ya iku aktris lan model kang kebangsaané Amérikah Sarékat kondhang amarga dadi bintang filem ning Holiday In the Sun (2001), Ning umur 5 taun, dhèwèké wus olih pelatihan ning babagan drama lan jogèd ning lembaga sosial ning kutha kalairané.Ning umur 10 taun, dhèwèké pindah ning florida amarga dhèwèké remen ning babagan akting, akting disinauni nganti lulus SMU.Ning umuré kang 13 taun, Megan cilik wis duwé bakat ning babagan seni.Dhèwèké tau menang kompetisi ning babagan modeling lan jogèd, iki kang mbuktikaké.Nanging ning taun 2001, Megan nembé nyoba akting ning dunya filem.Filmé kang pisanan judhulé HOLIDAY IN THE SUN, filem iki mbuka kariré ning dunya seni peran.Peran pembantu kang tau dilakoni déning dhèwèké anggawe dhèwèké olih kahormatan kanggo dadi pemeran utama ning filem TRANSFORMES kang dirilis ning taun 2007.Megan kang nembé-nembé iki dinobataké paca pambaca priya dadi wanita paling seksi.Darah Indian kang ngalir ning awaké anggawe dhèwèké seneng maring tattoo.Ana 9 tattoo kalebu foto Marilyn Monroe anna ning awaké.Ning kauripané, Megan wus tunangan karo pepujaning atiné, Brian Austin Green.Megan lan Austin dadian awit taun 2004.Dhèwèké sempet nguumumaké kanggo nikah ning taun November 2006.Nanging, gayutané ora mulus.Megan pedot lamarané karo Brian ning akir wulan Fèbruari ning taun 2009.Akiré kanthi resmi Megan negasaké manawa dhèwèké wus putus karo Brian.Dhèwèké uga mbantah niaté kanggo nikahi mantan kekasihé mau.Wektu-wektu iki dhèwèké esih seneng urip dhèwèkan.Megan, mbantah berita-berita babagan gosip megan nganggo operasi botox.Kanggo mbantah berita mau Megan masang fhoto èlèk ning facebook pribadiné.Foto-foto mau, mbuktikaké manawa dhèwèké ora nganggo botox.","Category:1986 births|Category:21st-century American LGBTQ people|Category:21st-century American actresses|Category:Actors from St. Petersburg, Florida|Category:Actresses from Florida|Category:Actresses from Pinellas County, Florida|Category:All Wikipedia articles written in American English|Category:All articles with dead external links|Category:All articles with unsourced statements|Category:American LGBTQ models|Category:American actors with disabilities|Category:American bisexual actresses|Category:American child actresses|Category:American child models|Category:American film actresses|Category:American television actresses|Category:American voice actresses|Category:Articles with dead external links from June 2016|Category:Articles with hCards|Category:Articles with short description|Category:Articles with unsourced statements from August 2023|Category:Bisexual Christians|Category:Bisexual women models|Category:Commons category link is on Wikidata|Category:Female models from Florida|Category:LGBTQ actors with disabilities|Category:LGBTQ people from Florida|Category:Living people|Category:Models with disabilities|Category:Pages containing links to subscription-only content|Category:People with obsessive–compulsive disorder|Category:Short description is different from Wikidata|Category:Use American English from June 2021|Category:Use mdy dates from August 2022|Category:Webarchive template wayback links|Category:Wikipedia indefinitely move-protected pages|Category:Wikipedia indefinitely semi-protected biographies of living people",Megan Fox,jv,https://jv.wikipedia.org/wiki/Megan_Fox
71,"Gabriela Mistral yaiku penyair Chile.Jeneng asliné Lucila Godoy y Alcayaga.Dhèwèké lair ana Vicuña, Chile, tanggal 7 April 1889.Séda ana Hempstead, New York, Amérika Sarékat, tanggal 10 Januari 1957.Dhèwèké wong Amérika Latin pisanan kang éntuk pahargyan Nobel Sastra.Dhèwèké mulang kawit umur 15 taun, sinambi nerusaké nganti éntuk gelar profesor.Sasuwene urip, dhèwèké nulis sinambi dadi pendhidhik, mantri budaya, lan diplomat; pakarya diplomatike kalebu ana Madrid, Lisbon, Genoa, lan Nice.Dhèwèké uga entik gelar kehormatan saka Universities of Florence lan Guatemala lan dadi anggota kehormatan ana akèh masarakat budaya ana Chile uga Amérika Sarékat, Spanyol, lan Kuba.","Category:1889 births|Category:1957 deaths|Category:20th-century Chilean poets|Category:20th-century Chilean women writers|Category:20th-century pseudonymous writers|Category:All articles needing additional references|Category:Articles needing additional references from April 2017|Category:Articles with LibriVox links|Category:Articles with Spanish-language sources (es)|Category:Articles with hAudio microformats|Category:Articles with short description|Category:CS1 Nepali-language sources (ne)|Category:CS1 maint: others|Category:CS1 uses Nepali-language script (ne)|Category:Chilean Anti-Francoists|Category:Chilean Nobel laureates|Category:Chilean academics|Category:Chilean diplomats|Category:Chilean emigrants to the United States|Category:Chilean people of Basque descent|Category:Chilean people of Diaguita descent|Category:Chilean schoolteachers|Category:Chilean women diplomats|Category:Chilean women poets|Category:Columbia University faculty|Category:Deaths from pancreatic cancer in New York (state)|Category:Mestizo writers|Category:National Prize for Literature (Chile) winners|Category:Nobel laureates in Literature|Category:Nobelprize template using Wikidata property P8024|Category:Pages with Latin American Spanish IPA|Category:Pages with Spanish IPA|Category:People from Elqui Province|Category:People from Hempstead (village), New York|Category:People from Roslyn Harbor, New York|Category:Postmodern writers|Category:Pseudonymous women writers|Category:Short description is different from Wikidata|Category:Use dmy dates from October 2017|Category:Webarchive template wayback links|Category:Women Nobel laureates",Gabriela Mistral,jv,https://jv.wikipedia.org/wiki/Gabriela_Mistral
72,"Murasaki Shikibu (紫 式部 Murasaki Shikibu, +/- 973– 1014 utawa 1025) iku sawijinig panulis wanita, pujangga, lan réwang Kaisar Jepang nalika masa Heian. Dhèwèké misuwur dadi panulis ""Carita Genji"" (Genji Monogatari (源氏物語)), sing ditulis ing basa Jepang antara taun 1000 lan 1008, salah sijining roman sing wigati lan misuwur ing sajarah.",Category:10th-century novelists|Category:11th-century Japanese poets|Category:11th-century Japanese women writers|Category:11th-century Japanese writers|Category:11th-century deaths|Category:11th-century novelists|Category:970s births|Category:Articles containing Japanese-language text|Category:Articles with LibriVox links|Category:Articles with Open Library links|Category:Articles with Project Gutenberg links|Category:Articles with short description|Category:Buddhist poets|Category:Commons category link from Wikidata|Category:Featured articles|Category:Fujiwara clan|Category:Heian period Buddhists|Category:Hyakunin Isshu poets|Category:Japanese diarists|Category:Japanese literature|Category:Japanese novelists|Category:Japanese poetry|Category:Japanese women novelists|Category:Japanese women poets|Category:Ladies-in-waiting of Heian-period Japan|Category:Murasaki Shikibu|Category:Mythopoeic writers|Category:Nobility from Kyoto|Category:Pages using multiple image with auto scaled images|Category:People of Heian-period Japan|Category:Short description is different from Wikidata|Category:The Tale of Genji|Category:Unidentified people|Category:Use mdy dates from November 2023|Category:Webarchive template wayback links|Category:Women memoirists|Category:Women of medieval Japan|Category:Writers from Kyoto|Category:Year of birth uncertain|Category:Year of death uncertain,Murasaki Shikibu,jv,https://jv.wikipedia.org/wiki/Murasaki_Shikibu
73,"Louis-Victor-Pierre-Raymond, duc de Broglie (kawentar kanthi asma Louis de Broglie; lair ing Dieppe, Seine-Maritime, Prancis, 15 Agustus 1892 – pati ing Louveciennes, Prancis, 19 Maret 1987 ing umur 94 taun) piyambakipun fisikawan saking Prancis ingkang naté angsal Bebungah Nobel.Louis asalipun saking kulawarga Prancis ingkang kondhang, gadhah diplomasi sarta kamiliteran ingkang saé. Piyambakipun punika sajatosipun siswa sajarah, nanging pungkasan piyambakipun langkung remen tumut kangmasipun Maurice de Broglie ingkang nimba kawruh babagan ngèlmu fisika.Nalika taun 1924, tesis doktoral Broglie njlentrehaken babagan usulan manawa piranti ingkang owah gadhah sipat gelombang ingkang njangkepi sipat partikelipun. 2 taun sasampunipun, Erwin Schrodinger ngagge konsèp gelombang de Broglie kanggé ngembangaken téyori umum ingkang diagem nalika panelitian sesarengan kaliyan ilmuwan sanès kanggé njlentrehaken tandha-tandha atomik. Kawontenanipun gelombang de Broglie dibuktikaké nalika eksperimen difraksi berkas elektron nalika taun 1927 sarta taun 1929 piyambakipun angsal Bebungah Nobel Fisika.","Category:1892 births|Category:1987 deaths|Category:20th-century French physicists|Category:Academic staff of the University of Paris|Category:All articles needing additional references|Category:All articles with unsourced statements|Category:Articles containing French-language text|Category:Articles needing additional references from August 2019|Category:Articles needing additional references from June 2015|Category:Articles with French-language sources (fr)|Category:Articles with hCards|Category:Articles with short description|Category:Articles with unsourced statements from December 2023|Category:CS1 French-language sources (fr)|Category:CS1 errors: missing periodical|Category:Commons category link from Wikidata|Category:Dukes of Broglie|Category:Foreign associates of the National Academy of Sciences|Category:Foreign fellows of the Indian National Science Academy|Category:Foreign members of the Royal Society|Category:Foreign members of the USSR Academy of Sciences|Category:French Nobel laureates|Category:French military personnel of World War I|Category:French theoretical physicists|Category:Grand Cross of the Legion of Honour|Category:Kalinga Prize recipients|Category:Members of the Académie Française|Category:Members of the American Philosophical Society|Category:Members of the French Academy of Sciences|Category:Members of the International Academy of Quantum Molecular Science|Category:Members of the National Council of Vichy France|Category:Members of the Royal Swedish Academy of Sciences|Category:Nobel laureates in Physics|Category:Nobelprize template using Wikidata property P8024|Category:Officers of the French Academy of Sciences|Category:Pages including recorded pronunciations|Category:Pages using the Phonos extension|Category:Pages with French IPA|Category:People associated with CERN|Category:People from Dieppe, Seine-Maritime|Category:Presidents of the Société Française de Physique|Category:Quantum physicists|Category:Short description is different from Wikidata|Category:University of Paris alumni|Category:Use dmy dates from June 2016|Category:Webarchive template wayback links|Category:Winners of the Max Planck Medal",Louis de Broglie,jv,https://jv.wikipedia.org/wiki/Louis_Victor_de_Broglie
