,jv_intro,en_categories,title,language,link
52,"Lindsay Lohan utawa Lindsay Morgan Lohan ya iku aktris lan penyanyi kang lair ing New York, Amérika, nalika tanggal 2 Juli 1986. Lindsay lair minangka aktris lan musisi. Dhèwèké putri saka artis Dina Lohan. Dhèwèké kalebu artis keturunan blèsteran Irlandia lan Italia. Uripé sawisé dadi artis, ndadékaké uripé glamor lan bisa dipadhakaké karo Britney Spiers lan Paris Hilton. Lindsay tau duwé gayutan kang rinaket karo artis-artis kondhang.Lindsay tau kena masalah karo Paris Hilton amarga Paris Hilton nudhuh yèn Lindsay ngrebut pacaré kang jenengé Stravos. Saliyané iku, Lindsay uga kekancanan karo Anna Faris, dhèwèké uga tau kena masalah karo penyanyi Hilary Duff amarga dianggep ngrebut pacaré, Aaron Carter.","Category:1986 births|Category:20th-century American actresses|Category:21st-century American actresses|Category:21st-century American singer-songwriters|Category:21st-century American women singers|Category:Actresses from the Bronx|Category:All Wikipedia articles written in American English|Category:All articles containing potentially dated statements|Category:American child actresses|Category:American child pop musicians|Category:American child singers|Category:American expatriate actresses|Category:American expatriates in the United Arab Emirates|Category:American expatriates in the United Kingdom|Category:American film actresses|Category:American people convicted of theft|Category:American people of Irish descent|Category:American people of Italian descent|Category:American prisoners and detainees|Category:American soap opera actresses|Category:American television actresses|Category:American women pop singers|Category:American women singer-songwriters|Category:Articles containing potentially dated statements from 2015|Category:Articles containing potentially dated statements from April 2010|Category:Articles with hCards|Category:Articles with short description|Category:CS1 Flemish-language sources (nl-be)|Category:Cold Spring Harbor Jr./Sr. High School alumni|Category:Good articles|Category:Lindsay Lohan|Category:Living people|Category:Lohan family|Category:Motown artists|Category:Pages containing links to subscription-only content|Category:Pages using Sister project links with hidden wikidata|Category:Pages using Sister project links with wikidata namespace mismatch|Category:People from Cold Spring Harbor, New York|Category:People from Merrick, New York|Category:Short description is different from Wikidata|Category:Singers from New York (state)|Category:Universal Records artists|Category:Use American English from August 2020|Category:Use mdy dates from November 2021|Category:Wikipedia indefinitely move-protected pages|Category:Wikipedia indefinitely semi-protected biographies of living people",Lindsay Lohan,jv,https://jv.wikipedia.org/wiki/Lindsay_Lohan
53,"Jessica Marie Alba (lair ing Pomona, California, Amérika Sarékat, 28 April 1981; umur 43 taun) inggih punika aktris saking nagari Amérika Sarékat. Alba dados aktris télévisi lan aktris filem. Alba miwiti kariripun ing jagad télévisi lan filem biyoskup nalika nembé yuswa 13 taun ing Camp Nowhere lan The Secret World of Alex Mack taun 1994. Alba langkung misuwur amargi dados paraga ing sérial télévisi Dark Angel taun 2000-2002. Alba lajeng main ing filem-filem ingkang manéka warni kados Honey taun 2003, Sin City taun 2005, Fantastic Four taun 2005, Into the Blue taun 2005, Fantastic Four: Rise of the Silver Surfer lan Good Luck Chuck taun 2007.Jessica sampun angsal kanugrahan ingkang manéka warni, kados Teen Choice Award lan Saturn Award for Best Actress on Television, lan nominasi Golden Globe kanthi aktingipun ing filem Dark Angel.Alba lair ing Pomona, California saking pasangan Catherine (née Jensen) lan Mark Alba. Ibunipun saking keturunan (Dhènemarken-Kanada-Prancis), lan ramanipun keturunan (Meksiko-Amérika). Jessica gadhah sadhèrèk enem Joshua. Ramanipun nyambut damel ing Angkatan Udara Amérika Sarékat, lan sampun gantos panggènan (griya dhinas) saking Biloxi, Mississippi lan Del Rio, Texas, sadèrèngipun kondur dhateng California sadangunipun 9 taun. Alba ageng ing kulawarga konservatif, taksih nyepeng tradhisi, agaminipun Katulik, lan kulawarga Latin Amérika.","Category:1981 births|Category:20th-century American actresses|Category:21st-century American actresses|Category:21st-century American philanthropists|Category:Activists from California|Category:Actresses from Los Angeles|Category:All Wikipedia articles in need of updating|Category:All articles containing potentially dated statements|Category:American child actresses|Category:American company founders|Category:American feminists|Category:American film actresses|Category:American retail chief executives|Category:American television actresses|Category:American video game actresses|Category:American voice actresses|Category:American women chief executives|Category:American women company founders|Category:Articles containing potentially dated statements from 2014|Category:Articles with hCards|Category:Articles with short description|Category:Businesspeople from Los Angeles|Category:Businesspeople in online retailing|Category:Claremont High School (California) alumni|Category:Commons category link is on Wikidata|Category:Former Roman Catholics|Category:Hispanic and Latino American actresses|Category:Hispanic and Latino American feminists|Category:Jessica Alba|Category:Living people|Category:Pages with non-numeric formatnum arguments|Category:People from Claremont, California|Category:Short description is different from Wikidata|Category:Use mdy dates from October 2020|Category:Webarchive template wayback links|Category:Wikipedia articles in need of updating from November 2024|Category:Wikipedia indefinitely move-protected pages|Category:Wikipedia indefinitely semi-protected biographies of living people",Jessica Alba,jv,https://jv.wikipedia.org/wiki/Jessica_Alba
54,"Valentina Vladimirovna Tereshkova (basa Ruslan: Валенти́на Влади́мировна Терешко́ва;) iku kosmonot wanita Uni Soviet sing dadi wanita pisanan ing donya sing mabur menyang luar akasa kanthi migunakaké Vostok 6 ing taun 1963. Valentina dilaiarké ing Bolshoye Maslennikovo, sawijining désa cilik ing Yaroslavl Oblast, Ruslan tanggal 6 Maret 1937.","Category:1937 births|Category:1963 in spaceflight|Category:1st class Active State Councillors of the Russian Federation|Category:20th-century Russian women politicians|Category:21st-century Russian women politicians|Category:Anti-Ukrainian sentiment in Russia|Category:Articles containing Russian-language text|Category:Articles with hCards|Category:Articles with short description|Category:Astronaut-politicians|Category:Biography with signature|Category:CS1 Belarusian-language sources (be)|Category:CS1 Croatian-language sources (hr)|Category:CS1 Czech-language sources (cs)|Category:CS1 European Spanish-language sources (es-es)|Category:CS1 German-language sources (de)|Category:CS1 Russian-language sources (ru)|Category:CS1 Ukrainian-language sources (uk)|Category:Eighth convocation members of the State Duma (Russian Federation)|Category:EngvarB from May 2021|Category:Female air force generals and air marshals|Category:Full Cavaliers of the Order ""For Merit to the Fatherland""|Category:Good articles|Category:Grand Crosses of the Order of the Sun of Peru|Category:Heroes of the Soviet Union|Category:Living people|Category:Members of the Central Committee of the 24th Congress of the Communist Party of the Soviet Union|Category:Members of the Central Committee of the 25th Congress of the Communist Party of the Soviet Union|Category:Members of the Central Committee of the 26th Congress of the Communist Party of the Soviet Union|Category:Members of the Central Committee of the 27th Congress of the Communist Party of the Soviet Union|Category:Pages including recorded pronunciations|Category:Pages using the Phonos extension|Category:Pages with Russian IPA|Category:People from Yaroslavl Oblast|Category:Recipients of the Medal ""Participant of the military operation in Syria""|Category:Recipients of the Order of Friendship of Peoples|Category:Recipients of the Order of Honour (Russia)|Category:Recipients of the Order of Lenin|Category:Recipients of the Order of the Cross of Grunwald, 1st class|Category:Recipients of the Order of the Volta|Category:Russian Orthodox Christians from Russia|Category:Russian cosmonauts|Category:Russian individuals subject to European Union sanctions|Category:Russian individuals subject to U.S. Department of the Treasury sanctions|Category:Russian people of Belarusian descent|Category:Russian skydivers|Category:Seventh convocation members of the State Duma (Russian Federation)|Category:Short description is different from Wikidata|Category:Sixth convocation members of the State Duma (Russian Federation)|Category:Soviet Air Force generals|Category:Soviet atheists|Category:Soviet cosmonauts|Category:Soviet major generals|Category:Soviet politicians|Category:Soviet women aviators|Category:Soviet women in politics|Category:Specially Designated Nationals and Blocked Persons List|Category:State Prize of the Russian Federation laureates|Category:Textile workers|Category:Use dmy dates from March 2021|Category:Valentina Tereshkova|Category:Vostok program cosmonauts|Category:Webarchive template wayback links|Category:Women's International Democratic Federation people|Category:Women air force personnel of the Soviet Union|Category:Women astronauts|Category:Women military aviators",Valentina Tereshkova,jv,https://jv.wikipedia.org/wiki/Valentina_Tereshkova
55,"John Cena kanthi jeneng lair John Felix Anthony Cena, uga pegulat profésional, penyanyi Rap, lan aktor filem kang asalé saka Amérikah Sarékat. Cena uga duwé jejuluk John Cena , Mr. P, lan The Prototype. Cena lair ing kutha West Newbury, Massachusetts nalika tanggal 23 April 1977 .Cena miwiti dadi pegulat nalika lulus kuliah. Cena uga dadi aktor, filemé kaya ta The Marine, kang digawé karo World Wrestling Entertaintment. Mr. P kerep akting ing filem aksi.","Category:1977 births|Category:21st-century American male actors|Category:21st-century American male musicians|Category:21st-century American professional wrestlers|Category:21st-century American rappers|Category:21st-century male professional wrestlers|Category:All Wikipedia articles written in American English|Category:All articles containing potentially dated statements|Category:American car collectors|Category:American football offensive linemen|Category:American game show hosts|Category:American male film actors|Category:American male professional wrestlers|Category:American male rappers|Category:American male television actors|Category:American male voice actors|Category:American people of English descent|Category:American people of French-Canadian descent|Category:American philanthropists|Category:American professional wrestlers of Italian descent|Category:Articles containing potentially dated statements from 2001|Category:Articles with hAudio microformats|Category:Articles with hCards|Category:Articles with short description|Category:Biography with signature|Category:CS1: unfit URL|Category:CS1 Spanish-language sources (es)|Category:Catholics from Florida|Category:Catholics from Massachusetts|Category:Charity fundraisers (people)|Category:Columbia Records artists|Category:Commons category link is on Wikidata|Category:East Coast hip-hop musicians|Category:Exercise physiologists|Category:Internet memes|Category:Living people|Category:Male actors from Massachusetts|Category:Male actors from Tampa, Florida|Category:Money in the Bank winners|Category:Musicians from Tampa, Florida|Category:NWA/WCW/WWE United States Heavyweight Champions|Category:OVW Heavyweight Champions|Category:OVW Tag Team Champions|Category:Pages using embedded infobox templates with the title parameter|Category:People from Land o' Lakes, Florida|Category:People from West Newbury, Massachusetts|Category:Players of American football from Essex County, Massachusetts|Category:Pop rappers|Category:Professional wrestlers from Massachusetts|Category:Professional wrestlers from Tampa, Florida|Category:Rappers from Florida|Category:Rappers from Massachusetts|Category:Royal Rumble match winners|Category:S-aft: 'after' parameter includes the word 'incumbent'|Category:Short description is different from Wikidata|Category:Spokespersons|Category:Sportspeople from Essex County, Massachusetts|Category:Springfield College alumni|Category:Springfield Pride football players|Category:Television personalities from Florida|Category:Television producers from Florida|Category:Television producers from Massachusetts|Category:Template:Succession box: 'after' parameter includes the word 'incumbent'|Category:Use American English from April 2024|Category:Use mdy dates from May 2024|Category:WWE Champions|Category:Wikipedia indefinitely move-protected pages|Category:Wikipedia indefinitely semi-protected biographies of living people|Category:World Heavyweight Champions (WWE)|Category:World Tag Team Champions (WWE)|Category:World Tag Team Champions (WWE, 1971–2010)|Category:Wrestling Observer Newsletter award winners",John Cena,jv,https://jv.wikipedia.org/wiki/John_Cena
56,"William Wordsworth ya iku penyair saka Inggris.Dhèwèké nulis Lyrical Ballads taun 1798, karo Samuel Taylor Coleridge, kang banjur nuwuhaké gerakan Romantik Inggris.Dhèwèké lair ana Cockermouth, Cumberland, Inggris, tanggal 7 April 1770.Séda ana Rydal Mount, Westmorland, tanggal 23 April 1850.Ibuné séda nalika dhèwèké umur wolung taun, pengalaman iki ketok saka pakaryan pungkasané.Wordsworth lumebu Hawkshead Grammar School, nèng kéné dhèwèké wiwitan seneng geguritan.Bapaké séda nalika dhèwèké ing Hawkshead, ninggal dhèwèké lan seduluré papat.Wong tuwané, loro-loroné, séda saurungé dhèwèké umur 15 taun.Dhèwèké sinau ana Cambridge University.Nalika ana kana, dhèwèké ngisi wektu prèi mangsa panas lelungan menyang Switserlan lan Prancis.Dhèwèké antusias karo gegayuhané Revolusi Prancis.Dhèwèké wiwitan nulis geguritan nalika isih sekolah, nanging ora ana sing diterbitaké nganti taun 1793.","Category:1770 births|Category:1850 deaths|Category:18th-century Christian mystics|Category:18th-century English male writers|Category:18th-century English poets|Category:18th-century English writers|Category:19th-century Christian mystics|Category:19th-century English male writers|Category:19th-century English poets|Category:19th-century English writers|Category:19th-century mystics|Category:All accuracy disputes|Category:All articles with unsourced statements|Category:Alumni of St John's College, Cambridge|Category:Anglican poets|Category:Anglican writers|Category:Articles with Internet Archive links|Category:Articles with LibriVox links|Category:Articles with Project Gutenberg links|Category:Articles with disputed statements from January 2018|Category:Articles with short description|Category:Articles with unsourced statements from January 2025|Category:Articles with unsourced statements from June 2023|Category:Burials in Cumbria|Category:CS1 maint: numeric names: authors list|Category:English Anglicans|Category:English male poets|Category:Pages using Sister project links with hidden wikidata|Category:People associated with Durham University|Category:People educated at Hawkshead Grammar School|Category:People from Cockermouth|Category:People from Grasmere (village)|Category:Protestant mystics|Category:Romantic poets|Category:Short description matches Wikidata|Category:Sonneteers|Category:Use British English from August 2011|Category:Use dmy dates from April 2020|Category:Wikipedia articles incorporating a citation from the 1911 Encyclopaedia Britannica with Wikisource reference|Category:Wikipedia pending changes protected pages|Category:William Wordsworth|Category:Wordsworth family",William Wordsworth,jv,https://jv.wikipedia.org/wiki/William_Wordsworth
57,"Charles Babbage ya iku ilmuwan penemu mesin itung digital. Mesin itung kang tinemu Charles Babbage ya iku salah sawijining piranti kang paling misuwur ing sajarah perkembangan komputer, lan minangka kalkulator otomatis kang wiwitan. Mula dhèwèké sinebut Bapak Komputer. Charles Babbage lair ing Southwark, London, tanggal 26 Dhésèmber 1791. Bapake ya iku Benjamin Babbage ya iku sawijining pegawé bank. Nalika isih cilih, dhèwèké wis seneng wulangan matematika. Mula nalika dhèwèké sekolah ing Triniti Collage taun 1811, biji matematikane paling apik dhéwé. Malah, dhèwèké luwih pinter tinimbang gurune. Nalika umuré 20 taun, Babbage nyambut gawé minangka ahli matematika, mligi ing babagan babagan fungsi kalkulus. Taun 1816, dhèwèké dipilih dadi anggota Royal Society ya iku sawijining organisasi sains lan akademis independent ing Inggris Raya lan tokoh wigati ing Yayasan Astronomical Siciety, organisasi astronomi lan geofisika Inggris Raya taun 1920. Taun 1821, Babbage nyipta sawijining mesin kang bisa nyusun tabel matematika kang dijenengi diffrence Engine.Taun 1832, nalika dhèwèké nglengkapi mesin mau, Babbage nemu pamanggih ngenani mesi kang apik. Mesin iki diarani Analytical Engine kang ateges mesin kang manipulasi simbol umum lan duwé karakter saka komputer modern. Nanging karyané mau durung dikenal akèh wong, nanging nalika karya Babbage diterjemahake lan ditambah notes déning Ada Lovelace, karya Babbage langsung dikenal akèh wong. Saliyané mesin itung, Babage uga duwé karya-karya lan panemon, ing antarané ya iku Babbage nyipta sistem post modern ing Inggris, nyusun tabel asuransi wiwitan kang bisa diandalake, nemu locomotive cowcather, ya iku struktur kang wujudé wajik kang ana ing pérangan ngarep kreta kang bisa ngresiki rel saka gangguan, lan sapanunggale. Saliya iku, Babbage uga nyumbangake panyaruwe-panyaruwe sarta pemikiran ing babagan ékonomi lan pulitik. Salah sawijiné penghargaan kang ditampa déning Babbage ya iku gelar The Lucasian Chair of Mathematics saka Universitas Cambridge. Babbage tinggal donya ing London, tanggal 18 Oktober 1871.","Category:1791 births|Category:1871 deaths|Category:19th-century English engineers|Category:19th-century English mathematicians|Category:All articles with failed verification|Category:All articles with unsourced statements|Category:Alumni of Peterhouse, Cambridge|Category:Alumni of Trinity College, Cambridge|Category:Articles with Internet Archive links|Category:Articles with LibriVox links|Category:Articles with Project Gutenberg links|Category:Articles with failed verification from March 2019|Category:Articles with failed verification from October 2021|Category:Articles with hCards|Category:Articles with short description|Category:Articles with unsourced statements from December 2017|Category:Articles with unsourced statements from June 2022|Category:Biography with signature|Category:British business theorists|Category:Burials at Kensal Green Cemetery|Category:CS1 French-language sources (fr)|Category:CS1 maint: location missing publisher|Category:Charles Babbage|Category:Commons category link from Wikidata|Category:Corresponding members of the Saint Petersburg Academy of Sciences|Category:English Christians|Category:English computer scientists|Category:Fellows of the American Academy of Arts and Sciences|Category:Fellows of the Royal Astronomical Society|Category:Fellows of the Royal Society|Category:Fellows of the Royal Society of Edinburgh|Category:Lucasian Professors of Mathematics|Category:Mathematicians from London|Category:Pages containing links to subscription-only content|Category:Pages using cite ODNB with id parameter|Category:People educated at Totnes Grammar School|Category:People of the Industrial Revolution|Category:Recipients of the Gold Medal of the Royal Astronomical Society|Category:Short description matches Wikidata|Category:Use British English from November 2019|Category:Use dmy dates from June 2022|Category:Webarchive template wayback links|Category:Wikipedia articles incorporating a citation from the ODNB|Category:Wikipedia indefinitely move-protected pages|Category:Wikipedia pending changes protected pages",Charles Babbage,jv,https://jv.wikipedia.org/wiki/Charles_Babbage
58,"Sheikh Hasina Wazed (née Sheikh Hasina ; /ˈʃeɪk həˈsiːnə/ SHEKH ha-si-na; Banggala: শেখ হাসিনা ওয়াজেদ, salin aksara Shēkh Hasinā, [ˈʃekʰ ɦɐsina]; lair  28 Sèptèmber 1947; umur 77 taun) yaiku pulitikus Banggaladesa sing ngejabat minangka Mahamantri Banggaladesa sawise Januari 2009. Sadurunge, ia ngejabat minangka mahamantri saka Juni 1996 nganti Juli 2001. Ia menika mahamantri karo masa jabatan paling suwe ing sajarah Banggaladesa, karo total luwih saka 18 taun. Ia menika kepala pamrentahan wadon paling suwe ing donya.","Category:10th Jatiya Sangsad members|Category:11th Jatiya Sangsad members|Category:12th Jatiya Sangsad members|Category:1947 births|Category:20th-century Bangladeshi women politicians|Category:20th-century Bengalis|Category:20th-century Muslims|Category:20th-century women prime ministers|Category:21st-century Bangladeshi women politicians|Category:21st-century Bengalis|Category:21st-century Muslims|Category:21st-century women prime ministers|Category:5th Jatiya Sangsad members|Category:7th Jatiya Sangsad members|Category:8th Jatiya Sangsad members|Category:9th Jatiya Sangsad members|Category:All Wikipedia articles written in Bangladeshi English|Category:All articles with dead external links|Category:All articles with unsourced statements|Category:All pages needing cleanup|Category:Articles containing Bengali-language text|Category:Articles needing cleanup from October 2024|Category:Articles with Banglapedia links|Category:Articles with dead external links from May 2024|Category:Articles with short description|Category:Articles with unsourced statements from September 2021|Category:Awami League politicians|Category:Bangladeshi Sunni Muslims|Category:Bangladeshi exiles|Category:Bangladeshi expatriates in India|Category:Bangladeshi women in politics|Category:CS1 Bengali-language sources (bn)|Category:CS1 Hindi-language sources (hi)|Category:CS1 uses Bengali-language script (bn)|Category:Children of presidents of Bangladesh|Category:Children of prime ministers of Bangladesh|Category:Cleanup tagged articles with a reason field from October 2024|Category:Eden Mohila College alumni|Category:Female defence ministers|Category:Female interior ministers|Category:Heads of government who were later imprisoned|Category:Honorary Fellows of Bangla Academy|Category:Leaders of the Opposition (Bangladesh)|Category:Left-wing populists|Category:Living people|Category:Pages using Sister project links with hidden wikidata|Category:Pages with Bengali IPA|Category:Pages with non-numeric formatnum arguments|Category:People from Gopalganj District, Bangladesh|Category:People indicted for crimes against humanity|Category:Presidents of the Awami League|Category:Prime ministers of Bangladesh|Category:Sheikh Hasina|Category:Short description is different from Wikidata|Category:Tungipara Sheikh family|Category:University of Dhaka alumni|Category:Use Bangladeshi English from July 2021|Category:Use dmy dates from November 2024|Category:Webarchive template wayback links|Category:Wikipedia extended-confirmed-protected pages|Category:Wikipedia pages needing cleanup from October 2024|Category:Women dictators|Category:Women members of the Jatiya Sangsad|Category:Women opposition leaders",Sheikh Hasina,jv,https://jv.wikipedia.org/wiki/Sheikh_Hasina
