,ko_intro,en_categories,title,language,link
49,"무함마드 유누스(벵골어: মুহাম্মদ ইউনুস, 1940년 6월 28일 ~ )는 방글라데시의 은행가·경제학자·사회운동가이다. 빈민들에게 무담보 소액대출 운동을 하며 그라민 은행을 설립하여 빈곤퇴치에 앞장선 공로로 2006년 노벨 평화상을 수상하였다.",Category:1940 births|Category:Academic staff of the University of Chittagong|Category:Agriculture and food award winners|Category:All Wikipedia articles written in Bangladeshi English|Category:Articles containing Bengali-language text|Category:Articles with hCards|Category:Articles with short description|Category:Bangladeshi Nobel laureates|Category:Bangladeshi Sunni Muslims|Category:Bangladeshi bankers|Category:Bangladeshi businesspeople|Category:Bangladeshi economists|Category:CS1 Bengali-language sources (bn)|Category:CS1 uses Bengali-language script (bn)|Category:Chittagong College alumni|Category:Chittagong Collegiate School and College alumni|Category:Congressional Gold Medal recipients|Category:Development specialists|Category:Guardian topic template using Wikidata|Category:HuffPost writers and columnists|Category:International Simón Bolívar Prize recipients|Category:Living people|Category:Microfinance people|Category:Middle Tennessee State University faculty|Category:Muhammad Yunus|Category:New York Times topic template using Wikidata|Category:Nobel Peace Prize laureates|Category:Nobelprize template using Wikidata property P8024|Category:Pages using Sister project links with hidden wikidata|Category:Pages with Bengali IPA|Category:People appearing on C-SPAN|Category:People associated with Glasgow Caledonian University|Category:People from Hathazari Upazila|Category:People in international development|Category:Pfeffer Peace Prize laureates|Category:Presidential Medal of Freedom recipients|Category:Prime ministers of Bangladesh|Category:Ramon Magsaysay Award winners|Category:Recipients of the Independence Day Award|Category:Short description is different from Wikidata|Category:Social entrepreneurs|Category:The Elders (organization)|Category:United Nations Foundation|Category:University of Dhaka alumni|Category:Use Bangladeshi English from February 2020|Category:Use dmy dates from August 2024|Category:Vanderbilt University alumni|Category:Wikipedia pages semi-protected against vandalism|Category:Winners of the Nikkei Asia Prize|Category:Yunus interim government advisors,Muhammad Yunus,ko,https://ko.wikipedia.org/wiki/%EB%AC%B4%ED%95%A8%EB%A7%88%EB%93%9C_%EC%9C%A0%EB%88%84%EC%8A%A4
50,"셀마 오틸리아 로비사 라겔뢰프(스웨덴어: Selma Ottilia Lovisa Lagerlöf 셀마 오틸리아 로비사 라겔뢰브[*], 스웨덴어 발음: [ˈsɛ̂lːma ˈlɑ̂ːɡɛˌɭøːv], 문화어: 쎌마 라게를뢰프, 1858년 11월 20일~1940년 3월 16일)는 스웨덴의 작가이자 교사이다.1909년 노벨 문학상 부문에서 여성 최초 수상자로 등극한 여류 문학작가로, 1914년 스웨덴 한림원 회원으로도 등극한 최초의 여성이기도 하다.",Category:1858 births|Category:1940 deaths|Category:19th-century Swedish novelists|Category:20th-century Swedish novelists|Category:All articles with dead external links|Category:All articles with unsourced statements|Category:Articles containing Swedish-language text|Category:Articles with Internet Archive links|Category:Articles with LibriVox links|Category:Articles with Open Library links|Category:Articles with Project Gutenberg links|Category:Articles with Swedish-language sources (sv)|Category:Articles with dead external links from September 2022|Category:Articles with short description|Category:Articles with unsourced statements from December 2020|Category:CS1 Swedish-language sources (sv)|Category:Commons link is on Wikidata|Category:Liberals (Sweden) politicians|Category:Litteris et Artibus recipients|Category:Lutheran pacifists|Category:Lutheran writers|Category:Members of the Swedish Academy|Category:Nobel laureates in Literature|Category:Nobelprize template using Wikidata property P8024|Category:Open Library ID same as Wikidata|Category:Pages including recorded pronunciations|Category:Pages using the Phonos extension|Category:Pages with Swedish IPA|Category:People from Sunne Municipality|Category:Recipients of the Illis quorum|Category:SKBL template using Wikidata property P4963|Category:Selma Lagerlöf|Category:Short description is different from Wikidata|Category:Swedish-language writers|Category:Swedish Christian pacifists|Category:Swedish Lutherans|Category:Swedish Nobel laureates|Category:Swedish children's writers|Category:Swedish feminists|Category:Swedish short story writers|Category:Swedish suffragists|Category:Swedish women children's writers|Category:Swedish women novelists|Category:Use dmy dates from December 2017|Category:Webarchive template wayback links|Category:Wikipedia articles incorporating a citation from Collier's Encyclopedia|Category:Wikipedia articles incorporating a citation from the 1922 Encyclopaedia Britannica with Wikisource reference|Category:Wikipedia articles incorporating a citation from the Encyclopedia Americana with a Wikisource reference|Category:Wikipedia articles needing clarification from December 2020|Category:Wikipedia articles needing clarification from November 2024|Category:Women Nobel laureates|Category:Writers from Värmland,Selma Lagerlöf,ko,https://ko.wikipedia.org/wiki/%EC%85%80%EB%A7%88_%EB%9D%BC%EA%B2%94%EB%A2%B0%ED%94%84
51,"하지 모하마드 수하르토(인도네시아어: Haji Mohammad Soeharto, 1921년 6월 8일~2008년 1월 27일)는 인도네시아의 군사·정치 지도자였다. 보통 수하르토(인도네시아어: Soeharto, 문화어: 수하르또)라고 줄여 부른다. 1967년부터 1998년까지 오랫동안 독재 정치를 한 인도네시아의 대통령으로 널리 알려져 있다.32년 간 독재자로 살아오면서 1998년, 아시아에 몰아닥친 금융 위기와 이어진 IMF 체제하에서 그동안 부패 및 경제 실정에 대해 국민들의 독재 정부에 대한 반정부 시위를 했으며, 결국은 31년 간의 독재 정부를 청산하고 민주화를 일으키며 그는 대통령직에서 물러났다. 무슬림으로서 강경한 반공주의자로 당시에는 군인으로써 수카르노에 대한 군부 쿠데타를 일으켜 그를 가두어 자신이 대통령을 하게끔 만들었다. 집권기간 동안 철권통치를 일삼아 수많은 인권유린이 일어났으며, 이 과정에서 무려 100만~300만에 이르는 정적과 반대파들이 무자비하게 학살당하기도 했다.",Category:1921 births|Category:2008 deaths|Category:All articles with unsourced statements|Category:Articles containing Dutch-language text|Category:Articles containing Indonesian-language text|Category:Articles containing Japanese-language text|Category:Articles with short description|Category:Articles with unsourced statements from May 2018|Category:Articles with unsourced statements from May 2022|Category:CS1 Indonesian-language sources (id)|Category:CS1 maint: url-status|Category:Cendana family|Category:Chiefs of staff of the Indonesian Army|Category:Commanders of the Indonesian National Armed Forces|Category:Commons category link is on Wikidata|Category:Critics of Islamism|Category:Deaths from kidney failure in Indonesia|Category:Deaths from lung disease|Category:Deputy prime ministers of Indonesia|Category:Genocide perpetrators|Category:Golkar politicians|Category:Good articles|Category:Indonesian Sunni Muslims|Category:Indonesian anti-communists|Category:Indonesian generals|Category:Indonesian mass killings of 1965–1966 perpetrators|Category:Indonesian nationalists|Category:Javanese people|Category:Leaders who took power by coup|Category:Members of Pembela Tanah Air|Category:Ministers of defense of Indonesia|Category:New Order (Indonesia)|Category:Pages including recorded pronunciations|Category:Pages using multiple image with auto scaled images|Category:Pages using the Phonos extension|Category:Pages with Indonesian IPA|Category:People from Yogyakarta|Category:People of the Indonesian National Revolution|Category:Perpetrators of Indigenous genocides|Category:Political corruption|Category:Presidents of Indonesia|Category:Recipients of the Grand Order of Mugunghwa|Category:Recipients of the Order of Al-Hussein bin Ali|Category:Royal Netherlands East Indies Army personnel|Category:Secretaries-general of the Non-Aligned Movement|Category:Short description is different from Wikidata|Category:Suharto|Category:Use dmy dates from February 2024|Category:Webarchive template wayback links|Category:Wikipedia articles needing clarification from April 2014|Category:Wikipedia articles needing page number citations from March 2021,Suharto,ko,https://ko.wikipedia.org/wiki/%EC%88%98%ED%95%98%EB%A5%B4%ED%86%A0
52,"린제이 디 모건 로한(영어: Lindsay Dee Morgan Lohan, IPA: [ˈlin-zi ˈloʊ.ən] 1986년 7월 2일 ~ )은 미국의 배우, 가수이다. 아역 광고 모델로 데뷔해 월트 디즈니 회사의 영화에 주로 출연해 주목받는 10대 배우로 성장했으나, 최근에는 할리우드의 스캔들 메이커로서 잘 알려져 있다. 《프레리 홈 컴패니언》과 《바비》 등의 영화에서 호연을 펼쳐 연기력을 인정받고 있을 뿐 아니라, 2004년에는 머라이어 캐리의 성공을 이끈 과거 소니 레코드 사의 대표 토미 모톨라의 지휘 아래 음반을 발표하기도 했다.","Category:1986 births|Category:20th-century American actresses|Category:21st-century American actresses|Category:21st-century American singer-songwriters|Category:21st-century American women singers|Category:Actresses from the Bronx|Category:All Wikipedia articles written in American English|Category:All articles containing potentially dated statements|Category:American child actresses|Category:American child pop musicians|Category:American child singers|Category:American expatriate actresses|Category:American expatriates in the United Arab Emirates|Category:American expatriates in the United Kingdom|Category:American film actresses|Category:American people convicted of theft|Category:American people of Irish descent|Category:American people of Italian descent|Category:American prisoners and detainees|Category:American soap opera actresses|Category:American television actresses|Category:American women pop singers|Category:American women singer-songwriters|Category:Articles containing potentially dated statements from 2015|Category:Articles containing potentially dated statements from April 2010|Category:Articles with hCards|Category:Articles with short description|Category:CS1 Flemish-language sources (nl-be)|Category:Cold Spring Harbor Jr./Sr. High School alumni|Category:Good articles|Category:Lindsay Lohan|Category:Living people|Category:Lohan family|Category:Motown artists|Category:Pages containing links to subscription-only content|Category:Pages using Sister project links with hidden wikidata|Category:Pages using Sister project links with wikidata namespace mismatch|Category:People from Cold Spring Harbor, New York|Category:People from Merrick, New York|Category:Short description is different from Wikidata|Category:Singers from New York (state)|Category:Universal Records artists|Category:Use American English from August 2020|Category:Use mdy dates from November 2021|Category:Wikipedia indefinitely move-protected pages|Category:Wikipedia indefinitely semi-protected biographies of living people",Lindsay Lohan,ko,https://ko.wikipedia.org/wiki/%EB%A6%B0%EC%A0%9C%EC%9D%B4_%EB%A1%9C%ED%95%9C
53,"제시카 마리 알바(영어: Jessica Marie Alba, 1981년 4월 28일 ~ )는 미국의 배우, 모델이자 사업가이다. 1994년 13살이 되던 해 영화 《비밀 캠프》를 통해 데뷔하였다. 이후 2000년부터 2002년까지 방영된 텔레비전 드라마 시리즈 《다크 엔젤》을 통해 인지도를 높인다. 영화 《허니》(2003년), 《씬 시티》(2005년), 《블루 스톰》(2005년), 《굿 럭 척》(2007년) 등의 흥행 작품에 출연하였다.알바는 미국 성인 잡지 《맥심》에서 선정한 ""가장 핫한 스타 100인""에서 2003년과 2007년에 1위를 차지하였고, 2007년 FHM이 뽑은 가장 섹시한 여성으로 선정되었다. 하지만 그 해 3월에는 《플레이보이》측에서 그녀의 사진을 무단으로 표지 사진으로 실어 법정 싸움까지 번지기도 하였다. 또한 알바는 연기로 수상을 한 적이 몇 번 있는데, 《다크 엔젤》을 통해 틴 초이스 어워드와 새턴 어워드에서 최우수 여배우상을 수상하였다.","Category:1981 births|Category:20th-century American actresses|Category:21st-century American actresses|Category:21st-century American philanthropists|Category:Activists from California|Category:Actresses from Los Angeles|Category:All Wikipedia articles in need of updating|Category:All articles containing potentially dated statements|Category:American child actresses|Category:American company founders|Category:American feminists|Category:American film actresses|Category:American retail chief executives|Category:American television actresses|Category:American video game actresses|Category:American voice actresses|Category:American women chief executives|Category:American women company founders|Category:Articles containing potentially dated statements from 2014|Category:Articles with hCards|Category:Articles with short description|Category:Businesspeople from Los Angeles|Category:Businesspeople in online retailing|Category:Claremont High School (California) alumni|Category:Commons category link is on Wikidata|Category:Former Roman Catholics|Category:Hispanic and Latino American actresses|Category:Hispanic and Latino American feminists|Category:Jessica Alba|Category:Living people|Category:Pages with non-numeric formatnum arguments|Category:People from Claremont, California|Category:Short description is different from Wikidata|Category:Use mdy dates from October 2020|Category:Webarchive template wayback links|Category:Wikipedia articles in need of updating from November 2024|Category:Wikipedia indefinitely move-protected pages|Category:Wikipedia indefinitely semi-protected biographies of living people",Jessica Alba,ko,https://ko.wikipedia.org/wiki/%EC%A0%9C%EC%8B%9C%EC%B9%B4_%EC%95%8C%EB%B0%94
54,"발렌티나 블라디미로브나 테레시코바(러시아어: Валенти́на Влади́мировна Терешко́ва 1937년 3월 6일 ~ )은 러시아의 세계 최초 여성 우주인이며, 세계 최연소 여성 우주인의 기록도 보유하고 있다.1963년 6월 16일부터 1963년 6월 19일까지 보스토크 6호를 타고 70시간 50분 동안 지구를 48바퀴 돌았다. 즉 88분에 지구를 한 바퀴씩 돌았으며, 그 궤도의 원지점은 약 209km였고, 근지점은 약 179km였다. 그녀의 비행시간은 당시 미국 남자들의 비행시간을 전부 합친 것보다 길었다.동료 우주비행사인 안드리안 니콜라예프와 1963년 11월에 결혼하고 1964년에 딸을 낳았으나 1982년 이혼하고 의사와 재혼했다. 1977년 엔지니어링 박사 학위를 취득하였다.","Category:1937 births|Category:1963 in spaceflight|Category:1st class Active State Councillors of the Russian Federation|Category:20th-century Russian women politicians|Category:21st-century Russian women politicians|Category:Anti-Ukrainian sentiment in Russia|Category:Articles containing Russian-language text|Category:Articles with hCards|Category:Articles with short description|Category:Astronaut-politicians|Category:Biography with signature|Category:CS1 Belarusian-language sources (be)|Category:CS1 Croatian-language sources (hr)|Category:CS1 Czech-language sources (cs)|Category:CS1 European Spanish-language sources (es-es)|Category:CS1 German-language sources (de)|Category:CS1 Russian-language sources (ru)|Category:CS1 Ukrainian-language sources (uk)|Category:Eighth convocation members of the State Duma (Russian Federation)|Category:EngvarB from May 2021|Category:Female air force generals and air marshals|Category:Full Cavaliers of the Order ""For Merit to the Fatherland""|Category:Good articles|Category:Grand Crosses of the Order of the Sun of Peru|Category:Heroes of the Soviet Union|Category:Living people|Category:Members of the Central Committee of the 24th Congress of the Communist Party of the Soviet Union|Category:Members of the Central Committee of the 25th Congress of the Communist Party of the Soviet Union|Category:Members of the Central Committee of the 26th Congress of the Communist Party of the Soviet Union|Category:Members of the Central Committee of the 27th Congress of the Communist Party of the Soviet Union|Category:Pages including recorded pronunciations|Category:Pages using the Phonos extension|Category:Pages with Russian IPA|Category:People from Yaroslavl Oblast|Category:Recipients of the Medal ""Participant of the military operation in Syria""|Category:Recipients of the Order of Friendship of Peoples|Category:Recipients of the Order of Honour (Russia)|Category:Recipients of the Order of Lenin|Category:Recipients of the Order of the Cross of Grunwald, 1st class|Category:Recipients of the Order of the Volta|Category:Russian Orthodox Christians from Russia|Category:Russian cosmonauts|Category:Russian individuals subject to European Union sanctions|Category:Russian individuals subject to U.S. Department of the Treasury sanctions|Category:Russian people of Belarusian descent|Category:Russian skydivers|Category:Seventh convocation members of the State Duma (Russian Federation)|Category:Short description is different from Wikidata|Category:Sixth convocation members of the State Duma (Russian Federation)|Category:Soviet Air Force generals|Category:Soviet atheists|Category:Soviet cosmonauts|Category:Soviet major generals|Category:Soviet politicians|Category:Soviet women aviators|Category:Soviet women in politics|Category:Specially Designated Nationals and Blocked Persons List|Category:State Prize of the Russian Federation laureates|Category:Textile workers|Category:Use dmy dates from March 2021|Category:Valentina Tereshkova|Category:Vostok program cosmonauts|Category:Webarchive template wayback links|Category:Women's International Democratic Federation people|Category:Women air force personnel of the Soviet Union|Category:Women astronauts|Category:Women military aviators",Valentina Tereshkova,ko,https://ko.wikipedia.org/wiki/%EB%B0%9C%EB%A0%8C%ED%8B%B0%EB%82%98_%ED%85%8C%EB%A0%88%EC%8B%9C%EC%BD%94%EB%B0%94
55,"존 시나(영어: John Cena, 본명: 존 필릭스 앤서니 시나(John Felix Anthony Cena), 1977년 4월 23일~)는 미국의 프로레슬러, 배우이다. 그는 2001년 프로레슬링에 입문했다. PG 시대의 아이콘으로, 역대 최다인 통산 16회 챔피언에 오른 그는 역대 최고의 프로레슬러 중 한 명으로 널리 여겨진다.유행어로는 넌 날 볼 수 없지(You Can't See Me)가 있다. 피니쉬는 AA(FU)/애티튜드 어드저스트먼트(닐링 파이어맨즈 캐리 슬램), 애티튜드 어택(리버스 에스티오), 애티튜드 버스터(브레인버스터), 애티튜드 크랩(보스턴 크랩), 애티튜드 킥(점핑 빅 붓), 프론트 페이스락 커터, 라이트링 피스트(런닝 위스트 스매쉬), 에스티에프, 스핀 아웃 파워밤, 샤프슈터로 사용을 하게 된다. 최근에는 AA/애티튜드 어드저스트먼트, 에스티에프, 스핀 아웃 파워밤 등으로 시전한다.AA(FU)를 만든 이유는 당시 괴물 레슬러로 불리던 브록 레스너의 F5에 대비하기 위해서였다.","Category:1977 births|Category:21st-century American male actors|Category:21st-century American male musicians|Category:21st-century American professional wrestlers|Category:21st-century American rappers|Category:21st-century male professional wrestlers|Category:All Wikipedia articles written in American English|Category:All articles containing potentially dated statements|Category:American car collectors|Category:American football offensive linemen|Category:American game show hosts|Category:American male film actors|Category:American male professional wrestlers|Category:American male rappers|Category:American male television actors|Category:American male voice actors|Category:American people of English descent|Category:American people of French-Canadian descent|Category:American philanthropists|Category:American professional wrestlers of Italian descent|Category:Articles containing potentially dated statements from 2001|Category:Articles with hAudio microformats|Category:Articles with hCards|Category:Articles with short description|Category:Biography with signature|Category:CS1: unfit URL|Category:CS1 Spanish-language sources (es)|Category:Catholics from Florida|Category:Catholics from Massachusetts|Category:Charity fundraisers (people)|Category:Columbia Records artists|Category:Commons category link is on Wikidata|Category:East Coast hip-hop musicians|Category:Exercise physiologists|Category:Internet memes|Category:Living people|Category:Male actors from Massachusetts|Category:Male actors from Tampa, Florida|Category:Money in the Bank winners|Category:Musicians from Tampa, Florida|Category:NWA/WCW/WWE United States Heavyweight Champions|Category:OVW Heavyweight Champions|Category:OVW Tag Team Champions|Category:Pages using embedded infobox templates with the title parameter|Category:People from Land o' Lakes, Florida|Category:People from West Newbury, Massachusetts|Category:Players of American football from Essex County, Massachusetts|Category:Pop rappers|Category:Professional wrestlers from Massachusetts|Category:Professional wrestlers from Tampa, Florida|Category:Rappers from Florida|Category:Rappers from Massachusetts|Category:Royal Rumble match winners|Category:S-aft: 'after' parameter includes the word 'incumbent'|Category:Short description is different from Wikidata|Category:Spokespersons|Category:Sportspeople from Essex County, Massachusetts|Category:Springfield College alumni|Category:Springfield Pride football players|Category:Television personalities from Florida|Category:Television producers from Florida|Category:Television producers from Massachusetts|Category:Template:Succession box: 'after' parameter includes the word 'incumbent'|Category:Use American English from April 2024|Category:Use mdy dates from May 2024|Category:WWE Champions|Category:Wikipedia indefinitely move-protected pages|Category:Wikipedia indefinitely semi-protected biographies of living people|Category:World Heavyweight Champions (WWE)|Category:World Tag Team Champions (WWE)|Category:World Tag Team Champions (WWE, 1971–2010)|Category:Wrestling Observer Newsletter award winners",John Cena,ko,https://ko.wikipedia.org/wiki/%EC%A1%B4_%EC%8B%9C%EB%82%98
