,ko_intro,en_categories,title,language,link
69,"샤를리즈 테론(Charlize Theron /ʃɑːrˈliːz ˈθɛrən/ (샬리즈 세런)[*], 1975년 8월 7일 ~ )은 남아프리카 공화국과 미국의 배우, 영화 제작자, 모델이다. 《데블스 에드버킷》 (1997년), 《마이티 조 영》 (1998년), 《사이더 하우스》 (1999년), 《이탈리안 잡》 (2003년), 《핸콕》 (2008년), 《매드 맥스: 분노의 도로》 (2015년) 등의 헐리우드 영화에 출연하였다.연쇄살인범 에일린 워노스를 연기한 《몬스터》 (2003년)로 2004년 아카데미 여우주연상을 받았는데, 아프리카 배우로서는 첫 수상자이다. 《노스 컨츄리》에 출연하여 다시 아카데미 여우주연상 후보에 올랐다.","Category:1975 births|Category:20th-century American actresses|Category:20th-century South African actresses|Category:21st-century American actresses|Category:21st-century South African actresses|Category:Afrikaner people|Category:All Wikipedia articles written in South African English|Category:All articles with a promotional tone|Category:American abortion-rights activists|Category:American female models|Category:American film actresses|Category:American film producers|Category:American people of Afrikaner descent|Category:American people of Dutch descent|Category:American people of French descent|Category:American people of German descent|Category:American television actresses|Category:American voice actresses|Category:American women's rights activists|Category:American women film producers|Category:Articles with a promotional tone from December 2023|Category:Articles with hCards|Category:Articles with short description|Category:Best Actress Academy Award winners|Category:Best Drama Actress Golden Globe (film) winners|Category:CS1 Italian-language sources (it)|Category:Charlize Theron|Category:Independent Spirit Award for Best Female Lead winners|Category:Living people|Category:Naturalized citizens of the United States|Category:Outstanding Performance by a Female Actor in a Leading Role Screen Actors Guild Award winners|Category:Pages using Sister project links with hidden wikidata|Category:Pages using Sister project links with wikidata namespace mismatch|Category:Pages with Afrikaans IPA|Category:People from Benoni, South Africa|Category:Short description is different from Wikidata|Category:Silver Bear for Best Actress winners|Category:South African HIV/AIDS activists|Category:South African emigrants to the United States|Category:South African female models|Category:South African film actresses|Category:South African film producers|Category:South African people of Dutch descent|Category:South African people of French descent|Category:South African people of German descent|Category:South African television actresses|Category:South African voice actresses|Category:South African women's rights activists|Category:South African women activists|Category:TCMDb name template using non-numeric ID from Wikidata|Category:United Nations Messengers of Peace|Category:Use South African English from April 2021|Category:Use dmy dates from September 2021|Category:Webarchive template wayback links|Category:Wikipedia indefinitely move-protected pages|Category:Wikipedia indefinitely semi-protected pages",Charlize Theron,ko,https://ko.wikipedia.org/wiki/%EC%83%A4%EB%A5%BC%EB%A6%AC%EC%A6%88_%ED%85%8C%EB%A1%A0
70,"메건 데니즈 폭스(영어: Megan Denise Fox, 1986년 5월 16일~)는 미국의 배우, 모델이다. 2001년 영화 《홀리데이 인 더 선》을 통해서 데뷔를 했고, 2004년 《희망과 신념》에서 처음으로 주연을 맡았으며, 《드라마 퀸》 에도 출연하였다. 이후 2007년 블록버스터 영화 《트랜스포머》에서 미카엘라 베인스 역(주연)을 맡은 계기로 큰 인기를 얻게됨과 동시에 틴 초이스 어워드의 후보로 오르기도 했다. 2009년에는 트랜스포머의 두 번째 작인 《트랜스포머: 패자의 역습》에 출연해 훨씬 폭넓은 명성을 얻게되며, 같은 해에 《죽여줘! 제니퍼》에서도 주연을 맡았다.폭스는 현대에서 섹스 심벌로 가장 잘 알려진 여성 중 한명으로, 《맥심》, 《롤링 스톤》, 《FHM》와 같은 잡지에서 선정하는 섹시 순위에 자주 포함된다. 또한 미디어에서 ""차세대 안젤리나 졸리""라고 불릴 정도로 안젤리나 졸리와 많은 비교가 되고 있다. 한편, 《베버리 힐즈 아이들》에서 처음만난 브라이언 오스틴 그린과 2004년부터 정식적인 연애관계로 발전했다. 그리고 2010년 6월 하와이에서 브라이언 오스틴 그린과 함께 비밀리에 결혼을 올렸다. 2015년 8월 21일, 두 사람은 언론에 이혼을 공식 발표하고 이후 이혼 소송을 시작하였지만, 2016년 재결합과 세 번째 임신을 발표하였다.","Category:1986 births|Category:21st-century American LGBTQ people|Category:21st-century American actresses|Category:Actors from St. Petersburg, Florida|Category:Actresses from Florida|Category:Actresses from Pinellas County, Florida|Category:All Wikipedia articles written in American English|Category:All articles with dead external links|Category:All articles with unsourced statements|Category:American LGBTQ models|Category:American actors with disabilities|Category:American bisexual actresses|Category:American child actresses|Category:American child models|Category:American film actresses|Category:American television actresses|Category:American voice actresses|Category:Articles with dead external links from June 2016|Category:Articles with hCards|Category:Articles with short description|Category:Articles with unsourced statements from August 2023|Category:Bisexual Christians|Category:Bisexual women models|Category:Commons category link is on Wikidata|Category:Female models from Florida|Category:LGBTQ actors with disabilities|Category:LGBTQ people from Florida|Category:Living people|Category:Models with disabilities|Category:Pages containing links to subscription-only content|Category:People with obsessive–compulsive disorder|Category:Short description is different from Wikidata|Category:Use American English from June 2021|Category:Use mdy dates from August 2022|Category:Webarchive template wayback links|Category:Wikipedia indefinitely move-protected pages|Category:Wikipedia indefinitely semi-protected biographies of living people",Megan Fox,ko,https://ko.wikipedia.org/wiki/%EB%A9%94%EA%B1%B4_%ED%8F%AD%EC%8A%A4
71,"가브리엘라 미스트랄(Gabriela Mistral, 1889년 4월 7일 비쿠냐 ~ 1957년 1월 10일 미국 뉴욕주 헴프스테드)은 칠레의 시인이자 작가, 외교관인 루실라 고도이 데 알카야가 (Lucila de María del Perpetuo Socorro Godoy Alcayaga)의 필명이다. 라틴아메리카 출신으로는 처음으로 1945년 노벨 문학상을 수상했다.","Category:1889 births|Category:1957 deaths|Category:20th-century Chilean poets|Category:20th-century Chilean women writers|Category:20th-century pseudonymous writers|Category:All articles needing additional references|Category:Articles needing additional references from April 2017|Category:Articles with LibriVox links|Category:Articles with Spanish-language sources (es)|Category:Articles with hAudio microformats|Category:Articles with short description|Category:CS1 Nepali-language sources (ne)|Category:CS1 maint: others|Category:CS1 uses Nepali-language script (ne)|Category:Chilean Anti-Francoists|Category:Chilean Nobel laureates|Category:Chilean academics|Category:Chilean diplomats|Category:Chilean emigrants to the United States|Category:Chilean people of Basque descent|Category:Chilean people of Diaguita descent|Category:Chilean schoolteachers|Category:Chilean women diplomats|Category:Chilean women poets|Category:Columbia University faculty|Category:Deaths from pancreatic cancer in New York (state)|Category:Mestizo writers|Category:National Prize for Literature (Chile) winners|Category:Nobel laureates in Literature|Category:Nobelprize template using Wikidata property P8024|Category:Pages with Latin American Spanish IPA|Category:Pages with Spanish IPA|Category:People from Elqui Province|Category:People from Hempstead (village), New York|Category:People from Roslyn Harbor, New York|Category:Postmodern writers|Category:Pseudonymous women writers|Category:Short description is different from Wikidata|Category:Use dmy dates from October 2017|Category:Webarchive template wayback links|Category:Women Nobel laureates",Gabriela Mistral,ko,https://ko.wikipedia.org/wiki/%EA%B0%80%EB%B8%8C%EB%A6%AC%EC%97%98%EB%9D%BC_%EB%AF%B8%EC%8A%A4%ED%8A%B8%EB%9E%84
72,"무라사키 시키부(일본어: 紫 (むらさき)式 (しき)部 (ぶ), 973년경 ~ 1014년 및 1025년경)는 헤이안 시대 일본 황실의 궁녀로, 소설가이자 시인이기도 했다. 무라사키는 최초 소설 중 하나로 여기는 일본어 소설 《겐지모노가타리》의 작가로도 잘 알려져 있다. 겐지 이야기는 1000년에서 1012년 사이 집필했다. 무라시키 시키부는 필명이고, 본명은 알려지지 않았다. 1007년 황실 일기에서 언급한 궁녀 후지와라노 교코(藤原香子)로 추정할 뿐이다.헤이안 여성은 전통적으로 행정에서 쓰는 문자인 한문 학습을 받지 못했다. 그러나 학자였던 아버지 슬하에서 자란 무라사키는 한문에 뛰어난 소질을 보였고 유창하게 쓸 수 있게 되었다. 무라사키는 20대 중후반에 결혼해 딸을 낳았지만 남편은 결혼 2년 만에 죽었다. 무라사키가 《겐지모노가타리》의 집필을 시작한 시기는 확실하지 않지만, 결혼 생활 도중이나 과부가 된 직후로 추정된다. 후지와라노 미치나가는 1005년경 무라사키를 황실로 초빙하여 쇼시 황후의 시녀로 삼았다. 이는 무라사키가 가진 작가로서의 명성 때문으로 추정된다. 무라사키는 시녀로 일하면서도 계속 글을 썼고 작품에 궁정 생활을 담았다. 5~6년 후, 그녀는 은퇴하여 궁궐을 나오고, 쇼시와 함께 비와 호수 지역으로 간다. 무라사키가 사망한 연도는 학자에 따라 다르다. 대부분은 1014년까지 살았다는 설에 동의하지만 1031년까지 생존했다고 하는 사람들도 있다.무라사키는 시집 《무라사키 시키부 일기》와 소설 《겐지모노가타리》를 썼다. 겐지 이야기는 완성된 지 10년 만에 지방 곳곳으로 퍼졌다. 《겐지모노가타리》는 한 세기 만에 일본 문학의 고전으로 인정받았으며 많은 학술적 평가를 받게 되었다. 무라사키의 작품은 20세기 초에 번역되었다. 6권 분량의 영어 번역은 1933년에 완역되었다. 그녀의 작품은 헤이안 궁정 사회의 정점을 보여준다. 학자들은 이러한 작품의 중요함을 계속해서 느끼고 있다. 13세기부터 일본 화가들이 무라사키 작품의 삽화를 그렸으며 유명한 우키요에의 대가들도 그녀의 작품을 목판에 담았다.",Category:10th-century novelists|Category:11th-century Japanese poets|Category:11th-century Japanese women writers|Category:11th-century Japanese writers|Category:11th-century deaths|Category:11th-century novelists|Category:970s births|Category:Articles containing Japanese-language text|Category:Articles with LibriVox links|Category:Articles with Open Library links|Category:Articles with Project Gutenberg links|Category:Articles with short description|Category:Buddhist poets|Category:Commons category link from Wikidata|Category:Featured articles|Category:Fujiwara clan|Category:Heian period Buddhists|Category:Hyakunin Isshu poets|Category:Japanese diarists|Category:Japanese literature|Category:Japanese novelists|Category:Japanese poetry|Category:Japanese women novelists|Category:Japanese women poets|Category:Ladies-in-waiting of Heian-period Japan|Category:Murasaki Shikibu|Category:Mythopoeic writers|Category:Nobility from Kyoto|Category:Pages using multiple image with auto scaled images|Category:People of Heian-period Japan|Category:Short description is different from Wikidata|Category:The Tale of Genji|Category:Unidentified people|Category:Use mdy dates from November 2023|Category:Webarchive template wayback links|Category:Women memoirists|Category:Women of medieval Japan|Category:Writers from Kyoto|Category:Year of birth uncertain|Category:Year of death uncertain,Murasaki Shikibu,ko,https://ko.wikipedia.org/wiki/%EB%AC%B4%EB%9D%BC%EC%82%AC%ED%82%A4_%EC%8B%9C%ED%82%A4%EB%B6%80
73,"루이 빅토르 피에르 레몽 드 브로이 7세 공작(프랑스어: Louis Victor Pierre Raymond, 7th duc de Broglie,  [lwiː vikˈtɔʀ pjɛːʀ ʀɛˈmɔ̃ də ˈbʀœj]; 영어 발음: /də-bróugli/; 1892년 8월 15일 - 1987년 3월 19일)은 양자 이론에 획기적인 공헌을 한 프랑스 물리학자이자 귀족이었다. 1924년 박사 학위 논문에서 그는 전자의 파동성을 가정하고 모든 물질에는 파동의 특성을 갖는다고 제안했다. 이 개념은 파동-입자 이중성의 예인 드 브로이 가설로 알려져 있으며 양자역학 이론의 중심 부분을 형성한다.드 브로이는 1927년 물질의 파동과 같은 거동이 실험적으로 처음으로 입증된 후 1929년 노벨 물리학상을 수상했다.1925년 파일럿 파동(pilot-wave) 모형과 드 브로이에 의해 발견된 입자의 파동과 같은 거동은 에르빈 슈뢰딩거가 파동 역학의 공식화에서 사용했다. 파일럿 파동 모형과 해석은 양자 형식주의에 찬성하여 1952년 데이비드 봄에 의해 재발견되고 향상될 때까지 포기되었다.루이 드 브로이는 1944년 아카데미 프랑세즈의 의석 1번 자리를 차지하기 위해 선출된 16번째 회원이며 프랑스 과학 아카데미의 상임 비서를 역임했다. 드 브로이는 유럽 원자력 연구 기구(CERN)의 설립으로 이어진 제안인 다국적 연구소의 설립을 요구한 최초의 고위 과학자가 되었다.","Category:1892 births|Category:1987 deaths|Category:20th-century French physicists|Category:Academic staff of the University of Paris|Category:All articles needing additional references|Category:All articles with unsourced statements|Category:Articles containing French-language text|Category:Articles needing additional references from August 2019|Category:Articles needing additional references from June 2015|Category:Articles with French-language sources (fr)|Category:Articles with hCards|Category:Articles with short description|Category:Articles with unsourced statements from December 2023|Category:CS1 French-language sources (fr)|Category:CS1 errors: missing periodical|Category:Commons category link from Wikidata|Category:Dukes of Broglie|Category:Foreign associates of the National Academy of Sciences|Category:Foreign fellows of the Indian National Science Academy|Category:Foreign members of the Royal Society|Category:Foreign members of the USSR Academy of Sciences|Category:French Nobel laureates|Category:French military personnel of World War I|Category:French theoretical physicists|Category:Grand Cross of the Legion of Honour|Category:Kalinga Prize recipients|Category:Members of the Académie Française|Category:Members of the American Philosophical Society|Category:Members of the French Academy of Sciences|Category:Members of the International Academy of Quantum Molecular Science|Category:Members of the National Council of Vichy France|Category:Members of the Royal Swedish Academy of Sciences|Category:Nobel laureates in Physics|Category:Nobelprize template using Wikidata property P8024|Category:Officers of the French Academy of Sciences|Category:Pages including recorded pronunciations|Category:Pages using the Phonos extension|Category:Pages with French IPA|Category:People associated with CERN|Category:People from Dieppe, Seine-Maritime|Category:Presidents of the Société Française de Physique|Category:Quantum physicists|Category:Short description is different from Wikidata|Category:University of Paris alumni|Category:Use dmy dates from June 2016|Category:Webarchive template wayback links|Category:Winners of the Max Planck Medal",Louis de Broglie,ko,https://ko.wikipedia.org/wiki/%EB%A3%A8%EC%9D%B4_%EB%93%9C_%EB%B8%8C%EB%A1%9C%EC%9D%B4
74,"메수트 외질(독일어·튀르키예어: Mesut Özil, 독일어 발음: [ˈmeːzut ˈøːzil], 튀르키예어 발음: [meˈsut œˈzil], 1988년 10월 15일~)은 독일의 축구인으로 현역 시절 공격형 미드필더로 활동했다. 주요 포지션은 공격형 미드필더였지만 와이드 미드필더로도 활동할 수 있었다.외질은 2006년을 기점으로 청소년 국가대표로 활약했으며, 2009년을 기점으로 독일 국가대표팀에서 활약했다. 그는 2010년 FIFA 월드컵에서의 활약으로 국제적 관심을 불러모았고, 대회 최우수 선수에게 수여되는 골든 볼 후보로도 지명되었다. 외질은 2006년 고향의 분데스리가 구단인 샬케 04에서 성인 무대에 데뷔했고, 2008년에는 베르더 브레멘에 이적했으며, 2010년 8월에는 FIFA 월드컵에서 독일 대표로 보인 훌륭한 활약상을 바탕으로 레알 마드리드에 입단했다. 2013년 여름 이적시장 말일, 아스널은 £42.5M의 구단 기록에 그를 영입했고, 독일 선수로는 역대 최고 이적료를 기록했다.외질은 공격형 미드필더로서의 자질과 창조력으로 알려져 있다. 그는 주제 모리뉴 감독에 의해 동료의 골을 돕는 능력이 전 레알 마드리드 전설인 지네딘 지단과 견주어졌다. 2010-11 시즌, 외질은 유럽 및 국내 대회에서 25도움을 기록해 이 부문에서 최고를 기록했다. 2011-12 시즌, 그는 17도움으로 라 리가 도움 1위를 차지했다. 외질은 2010년 FIFA 월드컵과 UEFA 유로 2012에서 각각 3번 도움을 기록해 두 대회에서 모두 공동 최다 도움을 기록했다.",Category:1988 births|Category:2010 FIFA World Cup players|Category:2014 FIFA World Cup players|Category:2018 FIFA World Cup players|Category:21st-century German sportsmen|Category:All articles with dead external links|Category:All articles with unsourced statements|Category:All pages needing factual verification|Category:Arsenal F.C. players|Category:Articles using Template:Medal with Winner|Category:Articles with German-language sources (de)|Category:Articles with dead external links from July 2023|Category:Articles with dead external links from May 2023|Category:Articles with permanently dead external links|Category:Articles with short description|Category:Articles with unsourced statements from June 2020|Category:Association football controversies|Category:Bundesliga players|Category:CS1 French-language sources (fr)|Category:CS1 German-language sources (de)|Category:CS1 Spanish-language sources (es)|Category:CS1 Turkish-language sources (tr)|Category:CS1 maint: multiple names: authors list|Category:CS1 maint: numeric names: authors list|Category:EngvarB from August 2019|Category:Expatriate men's footballers in England|Category:Expatriate men's footballers in Spain|Category:Expatriate men's footballers in Turkey|Category:FC Schalke 04 players|Category:FIFA World Cup–winning players|Category:Fenerbahçe S.K. footballers|Category:Footballers from Gelsenkirchen|Category:German Muslims|Category:German anti-Zionists|Category:German autobiographers|Category:German expatriate men's footballers|Category:German expatriate sportspeople in England|Category:German expatriate sportspeople in Spain|Category:German expatriate sportspeople in Turkey|Category:German men's footballers|Category:German sportspeople of Turkish descent|Category:Germany men's international footballers|Category:Germany men's under-21 international footballers|Category:Germany men's youth international footballers|Category:La Liga players|Category:Living people|Category:Men's association football midfielders|Category:Pages using Sister project links with hidden wikidata|Category:Pages using national squad without sport or team link|Category:Pages with German IPA|Category:Pages with Turkish IPA|Category:People educated at the Gesamtschule Berger Feld|Category:Politics and sports|Category:Premier League players|Category:Real Madrid CF players|Category:SV Werder Bremen players|Category:Short description is different from Wikidata|Category:Süper Lig players|Category:UEFA Euro 2012 players|Category:UEFA Euro 2016 players|Category:Use dmy dates from June 2024|Category:Wikipedia articles needing factual verification from October 2018|Category:Wikipedia indefinitely semi-protected pages|Category:İstanbul Başakşehir F.K. players,Mesut Özil,ko,https://ko.wikipedia.org/wiki/%EB%A9%94%EC%88%98%ED%8A%B8_%EC%99%B8%EC%A7%88
75,"세르게이 미하일로비치 브린(러시아어: Серге́й Миха́йлович Брин, 영어: Sergey Brin 서게이 브린[*], 1973년 8월 21일 ~)은 소비에트 연방 출신의 미국 시민권자 기업인으로서 래리 페이지와 함께 구글을 창립했다.브린은 러시아의 모스크바에서 모스크바 대학을 졸업한 유대인 부부의 아들로 태어났다. 6살 때 미국에 온 그는 후에 메릴랜드 대학에서 수학과 교수로 재직하게 된 아버지 덕분에 수학에 많은 흥미를 보였으며, 이를 계기로 그는 고등학교 졸업 후 메릴랜드 대학에 입학하여 수학과 컴퓨터 과학 전공으로 학부를 마쳤다. 이후 그는 스탠포드 대학교 대학원으로 진학하여 컴퓨터 과학을 전공하였다. 컴퓨터 과학 석사학위를 취득한 그는 박사과정을 밟았으나, 도중에 래리 페이지를 만나 박사과정을 그만두고 1998년 친구의 차고에서 구글을 창립하였다.브린은 현재 구글의 기술 부문 사장(President of Technology)이며 2008년 3월 5일 현재 약 187억 달러의 순자산(net worth)을 가지고 있으며 세계 32번째 부자이다. 2016년 3월 구글의 자회사인 딥마인드가 개발한 알파고(AlphaGo) 인공지능 바둑 프로그램과 한국 이세돌의 바둑 대국을 관전하기 위해 처음으로 한국을 방문했다.","Category:1973 births|Category:21st-century American Jews|Category:21st-century American inventors|Category:21st-century American philanthropists|Category:All Wikipedia articles written in American English|Category:All articles containing potentially dated statements|Category:All articles lacking reliable references|Category:Alphabet Inc. people|Category:American billionaires|Category:American computer businesspeople|Category:American computer programmers|Category:American computer scientists|Category:American information technology businesspeople|Category:American people of Russian-Jewish descent|Category:American technology chief executives|Category:American technology company founders|Category:Articles containing Russian-language text|Category:Articles containing potentially dated statements from 2008|Category:Articles lacking reliable references from December 2024|Category:Articles with hCards|Category:Articles with short description|Category:Biography with signature|Category:Business duos|Category:Businesspeople from Maryland|Category:Businesspeople from the San Francisco Bay Area|Category:Businesspeople in software|Category:Directors of Alphabet Inc.|Category:Good articles|Category:Google employees|Category:Internet pioneers|Category:Jewish American scientists|Category:Life extensionists|Category:Living people|Category:Members of the United States National Academy of Engineering|Category:Naturalized citizens of the United States|Category:Pages using Sister project links with hidden wikidata|Category:Pages using Sister project links with wikidata namespace mismatch|Category:People appearing on C-SPAN|Category:People from Adelphi, Maryland|Category:People from Greenbelt, Maryland|Category:Short description is different from Wikidata|Category:Soviet Jews|Category:Soviet emigrants to the United States|Category:Stanford University School of Engineering alumni|Category:University of Maryland, College Park alumni|Category:Use American English from March 2015|Category:Use mdy dates from August 2022|Category:Web developers|Category:Webarchive template wayback links|Category:Wikipedia pending changes protected pages|Category:Wojcicki family|Category:World Economic Forum Young Global Leaders",Sergey Brin,ko,https://ko.wikipedia.org/wiki/%EC%84%B8%EB%A5%B4%EA%B2%8C%EC%9D%B4_%EB%B8%8C%EB%A6%B0
