,mr_intro,en_categories,title,language,link
0,"ऋषी सुनक (Rishi Sunak; जन्म १२ मे १९८०) हे एक ब्रिटिश राजकारणी आहेत. २५ ऑक्टोबर २०२२ पासून ते युनायटेड किंग्डमचे पंतप्रधान आणि २४ ऑक्टोबर २०२२ तेथील कंझर्व्हेटिव्ह पक्षाचे नेते आहेत. सुनक हे युनायटेड किंग्डमचे पहिले ब्रिटिश आशियाई आणि पहिले हिंदू पंतप्रधान आहेत.  २०२० ते २०२२ पर्यंत ते युनायटेड किंग्डमचे अर्थमंत्री आणि २०१९ ते २०२० पर्यंत कोषागाराचे मुख्य सचिव होते. २०१५ पासून ते रिचमंड (यॉर्क्स) मतदारसंघाचे खासदार आहेत.१९६० च्या दशकात पूर्व आफ्रिकेतून ब्रिटनमध्ये स्थलांतरित झालेल्या भारतीय वंशाच्या पालकांमध्ये सुनकचा जन्म साउदम्प्टन येथे झाला. त्यांचे शिक्षण विंचेस्टर कॉलेजमध्ये झाले, त्यांनी ऑक्सफर्डच्या लिंकन कॉलेजमध्ये तत्त्वज्ञान, राजकारण आणि अर्थशास्त्राचा अभ्यास केला आणि फुलब्राइट स्कॉलर म्हणून स्टॅनफोर्ड विद्यापीठातून एमबीए केले. स्टॅनफोर्डमध्ये असताना, त्यांनी त्यांची भावी पत्नी अक्षता मूर्ती, भारतीय अब्जाधीश इन्फोसिसचे एन.आर. नारायण मूर्ती यांची मुलगी भेटली. ग्रॅज्युएट झाल्यानंतर, सुनकने गोल्डमन सॅक्ससाठी आणि नंतर द चिल्ड्रन्स इन्व्हेस्टमेंट फंड मॅनेजमेंट आणि थेलेम पार्टनर्स या हेज फंड फर्ममध्ये भागीदार म्हणून काम केले.सनक हे २०१५ च्या सार्वत्रिक निवडणुकीत नॉर्थ यॉर्कशायरमधील रिचमंडसाठी हाउस ऑफ कॉमन्समध्ये निवडून आले, विल्यम हेग यांच्यानंतर. सुनकने २०१६ च्या युरोपियन संघ सदस्यत्वावरील सार्वमतामध्ये ब्रेक्झिटला पाठिंबा दिला होता. २०१८ च्या फेरबदलामध्ये थेरेसा मे यांच्या दुसऱ्या सरकारमध्ये स्थानिक सरकारचे संसदीय अंडर-सेक्रेटरी म्हणून त्यांची नियुक्ती करण्यात आली होती. त्यांनी मेच्या ब्रेक्झिट माघारी कराराच्या बाजूने तीन वेळा मतदान केले. मे यांनी राजीनामा दिल्यानंतर, सुनक यांनी बोरिस जॉन्सन यांच्या कंझर्व्हेटिव्ह नेते होण्याच्या मोहिमेला पाठिंबा दिला. जॉन्सन पंतप्रधान झाल्यानंतर सुनक यांची ट्रेझरीचे मुख्य सचिव म्हणून नियुक्ती करण्यात आली. फेब्रुवारी २०२० च्या मंत्रिमंडळ फेरबदलात जाविद यांच्या राजीनाम्यानंतर सुनक यांनी साजिद जाविद यांच्या जागी राजकोषाचे कुलपती म्हणून नियुक्ती केली. कुलपती या नात्याने, कोविड-१९ महामारीला सरकारच्या आर्थिक प्रतिसादात आणि कोरोनाव्हायरस जॉब रिटेन्शन आणि इट आउट टू हेल्प आउट योजनांसह त्याचे आर्थिक परिणाम यामध्ये सुनक प्रमुख होते. त्यांनी जुलै २०२२ मध्ये कुलपतीपदाचा राजीनामा दिला, त्यानंतर सरकारी संकटात जॉन्सन यांनी राजीनामा दिला.जॉन्सनची जागा घेण्यासाठी सनक कंझर्व्हेटिव्ह पक्षाच्या नेतृत्वाच्या निवडणुकीत उभे राहिले आणि सदस्यांचे मत लिझ ट्रस यांना गमावले. सरकारी संकटात ट्रसच्या राजीनाम्यानंतर, सनक यांची २४ ऑक्टोबर २०२२ रोजी कंझर्व्हेटिव्ह पक्षाचे नेते म्हणून बिनविरोध निवड करण्यात आली. किंग चार्ल्स III यांनी त्यांची पंतप्रधान म्हणून नियुक्ती केली, त्यांच्या कारकिर्दीत प्रथम नियुक्ती करण्यात आली, एका दिवसानंतर, ते पहिले ब्रिटिश बनले. आशियाई आणि हिंदू हे स्थान धारण करतील","Category:1980 births|Category:21st-century prime ministers of the United Kingdom|Category:All articles with dead external links|Category:All articles with unsourced statements|Category:Alumni of Lincoln College, Oxford|Category:Articles with dead external links from February 2025|Category:Articles with hAudio microformats|Category:Articles with short description|Category:Articles with unsourced statements from September 2023|Category:British Indian history|Category:CS1 maint: multiple names: authors list|Category:Chancellors of the Exchequer of the United Kingdom|Category:Chief Secretaries to the Treasury|Category:Conservative Party (UK) MPs for English constituencies|Category:Conservative Party prime ministers of the United Kingdom|Category:English Hindus|Category:English people of Indian descent|Category:English people of Punjabi descent|Category:Goldman Sachs people|Category:Leaders of the Conservative Party (UK)|Category:Leaders of the Opposition (United Kingdom)|Category:Living people|Category:Members of the Privy Council of the United Kingdom|Category:Pages including recorded pronunciations|Category:Pages using Sister project links with hidden wikidata|Category:Pages using the Phonos extension|Category:Partygate scandal|Category:People appearing on C-SPAN|Category:People educated at Winchester College|Category:Politicians from Southampton|Category:Right-wing politics in the United Kingdom|Category:Rishi Sunak|Category:Short description matches Wikidata|Category:Stanford Graduate School of Business alumni|Category:UK MPs 2015–2017|Category:UK MPs 2017–2019|Category:UK MPs 2019–2024|Category:UK MPs 2024–present|Category:Use British English from December 2023|Category:Use dmy dates from February 2025|Category:Wikipedia indefinitely semi-protected pages",Rishi Sunak,mr,https://mr.wikipedia.org/wiki/%E0%A4%8B%E0%A4%B7%E0%A5%80_%E0%A4%B8%E0%A5%81%E0%A4%A8%E0%A4%95
1,विद्यादेवी भंडारी (जन्म  १९ जून १९६१)  या नेपाळच्या राष्ट्राध्यक्षा होत्या. या नेपाळच्या दुसऱ्या अध्यक्ष असून पहिल्या महिला अध्यक्ष आहेत.इ.स. १९७९ मध्ये ‘वाम’ आघाडीच्या माध्यमातून त्यांच्या राजकीय कारकिर्दीला सुरुवात झाली. त्या नेपाळ कम्युनिस्ट पक्षाच्या नेत्या आहेत. याआधी त्या नेपाळच्या संरक्षण मंत्री होत्या. त्यांचे वडील भोजपूर येथे एका शाळेत मुख्याध्यापक म्हणून कार्यरत होते. तर त्यांचे आजोबा सामाजिक कार्यात अग्रेसर होते. कम्युनिस्ट नेते मदनकुमार भंडारी हे त्यांचे पती होते. इ.स. १९९३ साली त्यांच्या पतीचे निधन झाले. १९९४ आणि १९९९ या दोन्ही वेळी त्यांनी संसदीय निवडणुकीत विजय मिळविला.,"Category:1961 births|Category:21st-century Nepalese women politicians|Category:21st-century women presidents|Category:Articles containing Nepali (macrolanguage)-language text|Category:Articles with short description|Category:CS1 Nepali-language sources (ne)|Category:Candidates for President of Nepal|Category:Commons category link from Wikidata|Category:Communist Party of Nepal (Unified Marxist–Leninist) politicians|Category:Female defence ministers|Category:Female heads of state|Category:First women presidents in Asia|Category:Independent politicians in Nepal|Category:Living people|Category:Members of the 2nd Nepalese Constituent Assembly|Category:Ministers of defence of Nepal|Category:Nepal MPs 1991–1994|Category:Nepal MPs 1994–1999|Category:Nepal MPs 1999–2002|Category:Nepalese Hindus|Category:Pages with Nepali (macrolanguage) IPA|Category:People from Bhojpur District, Nepal|Category:Presidents of Nepal|Category:Short description is different from Wikidata|Category:Use dmy dates from October 2015|Category:Women presidents in Asia",Bidya Devi Bhandari,mr,https://mr.wikipedia.org/wiki/%E0%A4%B5%E0%A4%BF%E0%A4%A6%E0%A5%8D%E0%A4%AF%E0%A4%BE%E0%A4%A6%E0%A5%87%E0%A4%B5%E0%A5%80_%E0%A4%AD%E0%A4%82%E0%A4%A1%E0%A4%BE%E0%A4%B0%E0%A5%80
2,"ग्रेटा टिनटिन एलिओनोरा थूनबर्ग (३ जानेवारी, २००३ - ) ही ग्लोबल वार्मिंग आणि हवामानातील बदल थांबविण्यासाठी कार्यरत असणारी स्वीडिश युवा राजकीय कार्यकर्ती आहे. ऑगस्ट २०१८ मध्ये, तिने पर्यावरणाची हानी थांबण्यासाठी स्वीडिश संसदेच्या इमारतीबाहेर सत्याग्रह केला. असे करणारी ती एक पहिली व्यक्ती बनली. . नोव्हेंबर २०१८मध्ये तिने टेडेक्सस्टॉकहोम येथे भाषण दिले. डिसेंबर २०१८मध्ये तिने युनायटेड नेशन्स क्लायमेट चेंज कॉन्फरन्सला संबोधित केले. तिला जानेवारी २०१९ मध्ये डॅव्होस येथील जागतिक आर्थिक मंचाशी बोलण्यास आमंत्रित करण्यात आले होते.",Category:2003 births|Category:21st-century Swedish people|Category:21st-century Swedish women|Category:Activists for Palestinian solidarity|Category:Activists with disabilities|Category:All articles containing potentially dated statements|Category:Articles containing Swedish-language text|Category:Articles containing potentially dated statements from April 2022|Category:Articles containing video clips|Category:Articles with hCards|Category:Articles with short description|Category:Autism activists|Category:Biography with signature|Category:CS1 Finnish-language sources (fi)|Category:CS1 French-language sources (fr)|Category:CS1 German-language sources (de)|Category:CS1 Portuguese-language sources (pt)|Category:CS1 Spanish-language sources (es)|Category:CS1 Swedish-language sources (sv)|Category:CS1 interproject-linked names|Category:CS1 interwiki-linked names|Category:Fellows of the Royal Scottish Geographical Society|Category:Good articles|Category:Greta Thunberg|Category:Living people|Category:Pages including recorded pronunciations|Category:Pages using the Phonos extension|Category:Pages with Swedish IPA|Category:Peace award winners|Category:People appearing on C-SPAN|Category:People from Stockholm|Category:People with Asperger syndrome|Category:People with obsessive–compulsive disorder|Category:Short description is different from Wikidata|Category:Sommar (radio program) hosts|Category:Swedish anti-Zionists|Category:Swedish climate activists|Category:Swedish environmentalists|Category:Swedish people with disabilities|Category:Swedish women environmentalists|Category:Time Person of the Year|Category:Use British English from January 2019|Category:Use dmy dates from March 2024|Category:Veganism activists|Category:Webarchive template wayback links|Category:Wikipedia indefinitely semi-protected biographies of living people|Category:Youth climate activists,Greta Thunberg,mr,https://mr.wikipedia.org/wiki/%E0%A4%97%E0%A5%8D%E0%A4%B0%E0%A5%87%E0%A4%9F%E0%A4%BE_%E0%A4%A5%E0%A5%82%E0%A4%A8%E0%A4%AC%E0%A4%B0%E0%A5%8D%E0%A4%97
3,"दुर्गा (संस्कृत: दुर्गा, IAST: Durgā) ही एक प्रमुख हिंदू देवी आहे, ज्याची पूजा मातृ देवी महादेवीचे प्रमुख पैलू म्हणून केली जाते.  ती संरक्षण, सामर्थ्य, मातृत्व, विनाश आणि युद्धांशी संबंधित आहे. शाक्त संप्रदाय मुख्य देवता आहे ज्याची तुलना सर्वोच्च ब्राह्मण शी केली जाते. दुर्गाचे वर्णन मूळ शक्ती, प्रबळ स्वभाव, सद्गुण योगमय, बुद्धीची आई आणि विकारांपासून मुक्त असे केले आहे. ती अंधकार आणि अज्ञानाच्या राक्षसांपासून संरक्षक आणि उपकारकर्ता आहे. असे मानले जाते की ती शांती, समृद्धी आणेल आणि धर्म वर हल्ला करणाऱ्या आसुरी शक्तींचा नाश करेल. सिंह वर स्वार होऊन देवी म्हणून दुर्गेचे प्रतिनिधित्व केले जाते. दुर्गा देवीला आठ हात आहेत, त्या सर्वांमध्ये काहीना काही शस्त्र आहे. त्याने महिषासुर नावाच्या राक्षसाचा वध केला. महिषासुर (= महिषा + असुर = म्हैस सारखा असुर) करतो. हिंदू ग्रंथांमध्ये तिचे शिवची पत्नी दुर्गा म्हणून वर्णन केले आहे. ज्या ज्योतिर्लिंगांमध्ये देवी दुर्गाची स्थापना केली जाते त्यांना सिद्धपीठ म्हणतात. तेथे केलेले सर्व ठराव पूर्ण झाले आहेत. दुर्गाम नावाच्या एका महान राक्षसाचा वध केल्यामुळे आईचे नाव दुर्गा देवी पडले. आईने शताक्षीचे रूप धारण केले आणि त्यानंतर शकंभारी देवी, ज्याला शाकंभरी देवी म्हणून ओळखले जाऊ लागले, त्यांनी दुर्गामासूरचा वध केला. ज्यामुळे ती संपूर्ण विश्वात दुर्गा देवीच्या नावाने प्रसिद्ध झाली. आईच्या देशात अनेक मंदिरे आहेत, कुठे महिषासुरमर्दिनी शक्तीपीठ तर कुठे कामाख्या देवी. ही देवी कोलकातामध्ये महाकाली म्हणून ओळखली जाते आणि सहारनपूरच्या प्राचीन शक्तीपीठात शाकंभरीच्या रूपात त्याची पूजा केली जाते.हिंदूंच्या शक्ती पंथात भगवती दुर्गा ही जगाची सर्वोच्च आणि सर्वोच्च देवता मानली जाते (शाक्त संप्रदाय ईश्वर यांना देवी मानतो).  वेद दुर्गाचा विस्तृत उल्लेख आहे, परंतु उपनिषद ""उमा हैमावती"" (हिमालयची मुलगी उमा) यांचे वर्णन करते. पुराण दुर्गाला आदिशक्ती मानले जाते. दुर्गा हे प्रत्यक्षात शिवची पत्नी आदिशक्तीचे रूप आहे, की शिवाच्या पराशक्तीचे वर्णन मूळ स्वभाव, सद्गुणी माया, बुद्धीची आणि विकारविरहित आई म्हणून केले गेले आहे. एकटे (केंद्रीत) झाल्यानंतरही, ती माया शक्ती योगायोगाने अनेक बनते. त्या आदिशक्ती देवीने सावित्री (ब्रह्माची पहिली पत्नी), लक्ष्मी आणि प्रामुख्याने पार्वती (सती) म्हणून जन्म घेतला आणि ब्रह्मा, विष्णू आणि महेश यांच्याशी लग्न केले. तीन रूपे असूनही दुर्गा (आदिशक्ती) एक आहे.देवी दुर्गाची स्वतः अनेक रूपे आहेत (सावित्री, लक्ष्मी आणि पार्वती सोडून). तिचे मुख्य रूप ""गौरी"" आहे ज्याचा अर्थ शांत, सुंदर आणि गोरा आहे. त्याचे सर्वात भयानक रूप """" काली """" आहे, म्हणजे काळे रूप. भारत आणि नेपाळच्या अनेक मंदिरांमध्ये आणि मंदिरांमध्ये दुर्गाची विविध स्वरूपात पूजा केली जाते. देवी दुर्गा सिंहावर स्वार आहे.मार्कंडेय पुराणात, ब्रह्देवने मानवजातीचे रक्षण करण्यासाठी मनुष्य, देवी कवच ​​आणि देवी सूक्त यांचे एक परम रहस्य, सर्वात उपयुक्त आणि कल्याण वर्णन केले आहे आणि असे म्हणले आहे की जो व्यक्ती हे उपाय करेल, तो या जगात सुख उपभोगेल. शेवटचा काळ. बैकुंठाला जाईल. ब्रह्देव म्हणाले की जो व्यक्ती दुर्गा सप्तशतीचे पठण करेल त्याला आनंद मिळेल. भागवत पुराणानुसार, आई जगदंबाने सर्वोत्तम पुरुषांचे रक्षण करण्यासाठी अवतार घेतला आहे. तर श्रीमद देवी भागवत यांच्या मते, वेद आणि पुराणांचे रक्षण करण्यासाठी आणि दुष्टांचा नाश करण्यासाठी आई जगदंबाने अवतार घेतला आहे. त्याचप्रमाणे, igग्वेदानुसार, आई दुर्गा ही आदिम शक्ती आहे, तिच्याकडून संपूर्ण जग चालवले जाते आणि तिच्याशिवाय दुसरा अविनाशी नाही.",Category:All articles with unsourced statements|Category:Articles containing Sanskrit-language text|Category:Articles having different image on Wikidata and Wikipedia|Category:Articles with short description|Category:Articles with unsourced statements from February 2017|Category:Articles with unsourced statements from January 2023|Category:Articles with unsourced statements from July 2023|Category:CS1 Bengali-language sources (bn)|Category:CS1 Hindi-language sources (hi)|Category:Commons category link from Wikidata|Category:Destroyer goddesses|Category:Durga|Category:Durga Puja|Category:EngvarB from August 2020|Category:Forms of Lakshmi|Category:Forms of Parvati|Category:Hindu goddesses|Category:Justice goddesses|Category:Mother goddesses|Category:Mythological swordfighters|Category:Shaktism|Category:Short description is different from Wikidata|Category:Use dmy dates from November 2021|Category:War goddesses|Category:Webarchive template wayback links,Durga,mr,https://mr.wikipedia.org/wiki/%E0%A4%A6%E0%A5%81%E0%A4%B0%E0%A5%8D%E0%A4%97%E0%A4%BE
