,mr_intro,en_categories,title,language,link
76,"अल्लाह रक्खा रहमान (तामिळ: ஏ. ஆர். ரகுமான், जन्म नाव: ए.एस. दिलीपकुमार, திலீப் குமார்) हे एक जगप्रसिद्ध भारतीय संगीतकार आहेत. आपल्या काळामधील सर्वश्रेष्ठ संगीतकार मानल्या जात असलेल्या रहमानने आजवर अनेक भाषांमधील चित्रपटांना संगीत देऊन जगभरातील चाहत्यांची मने जिंकली आहेत. रोजा, बॉम्बे, रंगीला, दिल से, लगान, रंग दे बसंती हे त्यांचे काही उल्लेखनीय चित्रपट आहेत. २००८ साली प्रदर्शित झालेल्या स्लमडॉग मिलियोनेर ह्या इंग्रजी चित्रपटाच्या संगीतासाठी ए. आर. रहमान यांना अनेक आंतरराष्ट्रीय पुरस्कार मिळाले.रहमान यांना आजवर दोन ऑस्कर पुरस्कार, दोन ग्रॅमी पुरस्कार, एक बाफ्टा पुरस्कार, एक गोल्डन ग्लोब पुरस्कार, चार राष्ट्रीय चित्रपट पुरस्कार, १५ फिल्मफेअर पुरस्कार व १३ फिल्मफेअर पुरस्कार दक्षिण मिळाले आहेत. आजवरच्या त्यांच्या दोन दशकांच्या कारकिर्दीत त्यांना भारतीय संगीताला नवी ओळख दिल्याचे श्रेय दिले जाते.",Category:1967 births|Category:A. R. Rahman|Category:All Wikipedia articles written in Indian English|Category:All articles lacking reliable references|Category:All articles with failed verification|Category:All articles with unsourced statements|Category:Alumni of Trinity College of Music|Category:Articles lacking reliable references from June 2022|Category:Articles with failed verification from April 2017|Category:Articles with hCards|Category:Articles with short description|Category:Articles with unsourced statements from March 2022|Category:Best Background Score National Film Award winners|Category:Best Music Direction National Film Award winners|Category:Best Original Music BAFTA Award winners|Category:Best Original Music Score Academy Award winners|Category:Best Original Song Academy Award–winning songwriters|Category:Biography with signature|Category:Bollywood playback singers|Category:CS1: long volume value|Category:CS1: unfit URL|Category:CS1 French-language sources (fr)|Category:CS1 Tamil-language sources (ta)|Category:CS1 errors: missing periodical|Category:CS1 maint: location missing publisher|Category:Columbia Records artists|Category:Commons category link is on Wikidata|Category:Filmfare Awards South winners|Category:Filmfare Awards winners|Category:Golden Globe Award winners|Category:Golden Globe Award–winning musicians|Category:Grammy Award winners|Category:IIFA Utsavam winners|Category:Indian Academy Award winners|Category:Indian Muslims|Category:Indian Sufis|Category:Indian Tamil people|Category:Indian male film score composers|Category:Indian male playback singers|Category:Jingle composers|Category:Living people|Category:Musicians from Tamil Nadu|Category:Pages using the Phonos extension|Category:Qadiri order|Category:Recipients of the Padma Bhushan in arts|Category:Recipients of the Padma Shri in arts|Category:Short description is different from Wikidata|Category:Singers from Chennai|Category:SuperHeavy members|Category:Tamil Muslims|Category:Tamil Nadu State Film Awards winners|Category:Tamil film score composers|Category:Tamil playback singers|Category:Telugu film score composers|Category:Telugu playback singers|Category:Use Indian English from December 2024|Category:Use dmy dates from December 2024|Category:Wikipedia indefinitely semi-protected pages|Category:Zee Cine Awards winners,A. R. Rahman,mr,https://mr.wikipedia.org/wiki/%E0%A4%8F.%E0%A4%86%E0%A4%B0._%E0%A4%B0%E0%A4%B9%E0%A4%AE%E0%A4%BE%E0%A4%A8
77,क्रिस्टन स्टुअर्ट (इंग्लिश: Kristen Stewart) ही एक अमेरिकन अभिनेत्री आहे. ती द ट्वायलाईट सागा ह्या चित्रपट शृंखलेमधील बेला स्वान ह्या पात्राच्या भुमिकेसाठी प्रसिद्ध आहे.,Category:1990 births|Category:20th-century American actresses|Category:21st-century American LGBTQ people|Category:21st-century American actresses|Category:Actresses from Los Angeles|Category:All Wikipedia articles written in American English|Category:All articles lacking reliable references|Category:American bisexual actresses|Category:American child actresses|Category:American feminists|Category:American film actresses|Category:American people of Australian descent|Category:American people of Jewish descent|Category:American television actresses|Category:Articles lacking reliable references from June 2023|Category:Articles with hCards|Category:Articles with short description|Category:BAFTA Rising Star Award winners|Category:Best Supporting Actress César Award winners|Category:Biography with signature|Category:Bisexual feminists|Category:CS1 maint: bot: original URL status unknown|Category:LGBTQ people from California|Category:Living people|Category:Pages using Sister project links with hidden wikidata|Category:Short description is different from Wikidata|Category:Use American English from April 2020|Category:Use mdy dates from July 2024|Category:Wikipedia indefinitely semi-protected biographies of living people,Kristen Stewart,mr,https://mr.wikipedia.org/wiki/%E0%A4%95%E0%A5%8D%E0%A4%B0%E0%A4%BF%E0%A4%B8%E0%A5%8D%E0%A4%9F%E0%A4%A8_%E0%A4%B8%E0%A5%8D%E0%A4%9F%E0%A5%81%E0%A4%85%E0%A4%B0%E0%A5%8D%E0%A4%9F
78,"हे चिनी नाव असून, आडनाव ली असे आहे.ली क्वान यू (ख्रिश्चन नाव: हॅरी, सोपी चिनी लिपी: 李光耀; फीन्यिन: Lǐ Guāngyào; रोमन लिपी: Lee Kuan Yew; १६ सप्टेंबर १९२३ - २३ मार्च २०१५) हा १९५९ ते १९९० सालांदरम्यान सिंगापुराच्या प्रजासत्ताकाचे पहिले पंतप्रधान असलेले राजकारणी होते. पंतप्रधानपदावर सर्वाधिक काळ अधिकारारूढ असलेल्या जगातल्या मोजक्या व्यक्तींपैकी ते एक होते.ते पीपल्स अ‍ॅक्शन पार्टीचे सहसंस्थापक व पहिले सर्वसाधारण सचिव होते. तत्कालीन ब्रिटिश मलाया-सिंगापुरात इ.स. १९५९ साली झालेल्या निवडणुकींत पक्षनेतृत्व करत मोठ्या फरकाने पक्षास विजय मिळवून देण्यात त्यांनी मोठा वाटा उचलला. मलेशियापासून इ.स. १९६५ साली सिंगापूर अलग करण्यात आल्यावर त्यांनी सिंगापुराचे नेतृत्व सांभाळत नैसर्गिक साधनसंपत्तीची देणगी नसलेल्या एके काळच्या वसाहतीला कालौघात पहिल्या जगातील देशाचा दर्जा मिळवून दिला. इ.स.च्या २० व्या शतकाच्या उत्तरार्धात आग्नेय आशियातील राजकीय पटलावरील सर्वाधिक प्रभावशाली राजकारण्यांमध्ये ते गणला जात होते. २३ मार्च २०१५ रोजी वृद्धापकाळाने त्यांचे निधन झाले.","Category:1923 births|Category:2015 deaths|Category:20th-century Singaporean lawyers|Category:All Wikipedia articles written in Singapore English|Category:All articles with dead external links|Category:All articles with style issues|Category:All articles with unsourced statements|Category:Alumni of Fitzwilliam College, Cambridge|Category:Alumni of the London School of Economics|Category:Alumni of the University of London|Category:Articles containing Chinese-language text|Category:Articles with dead external links from September 2023|Category:Articles with permanently dead external links|Category:Articles with short description|Category:Articles with unsourced statements from February 2019|Category:Articles with unsourced statements from November 2024|Category:CS1 Chinese-language sources (zh)|Category:CS1 Chinese (Singapore)-language sources (zh-sg)|Category:CS1 French-language sources (fr)|Category:CS1 uses Chinese-language script (zh)|Category:Conservatism in Singapore|Category:Deaths from pneumonia in Singapore|Category:Fellows of Fitzwilliam College, Cambridge|Category:Grand Cordons of the Order of the Rising Sun|Category:Hakka writers|Category:Honorary Knights Grand Cross of the Order of St Michael and St George|Category:Honorary members of the Order of the Companions of Honour|Category:Ig Nobel laureates|Category:Knights Grand Commander of the Order of the Crown of Johor|Category:Lawyers with disabilities|Category:Lee Kuan Yew|Category:Lee family (Singapore)|Category:Members of the Cabinet of Singapore|Category:Members of the Dewan Rakyat|Category:Members of the Legislative Assembly of Singapore|Category:Members of the Parliament of Singapore|Category:National Portrait Gallery (London) person ID same as Wikidata|Category:Pages using Sister project links with hidden wikidata|Category:Pages using Sister project links with wikidata namespace mismatch|Category:Pages using Template:Post-nominals with customized linking|Category:People's Action Party politicians|Category:People appearing on C-SPAN|Category:People of the Vietnam War|Category:Peranakan people in Singapore|Category:Politicians with dyslexia|Category:Prime ministers of Singapore|Category:Radicals|Category:Raffles Institution alumni|Category:Recipients of the Order of the Paulownia Flowers|Category:Short description is different from Wikidata|Category:Singaporean Confucianists|Category:Singaporean agnostics|Category:Singaporean anti-communists|Category:Singaporean independence activists|Category:Singaporean people of Hakka descent|Category:Singaporean people with disabilities|Category:Singaporean politicians of Chinese descent|Category:Singaporean politicians of Hakka descent|Category:Use Singapore English from July 2023|Category:Use dmy dates from January 2025|Category:Webarchive template wayback links|Category:Wikipedia articles with style issues from September 2022|Category:Writers with dyslexia",Lee Kuan Yew,mr,https://mr.wikipedia.org/wiki/%E0%A4%B2%E0%A5%80_%E0%A4%95%E0%A5%8D%E0%A4%B5%E0%A4%BE%E0%A4%A8_%E0%A4%AF%E0%A5%82
79,नेयमार दा सिल्वा सान्तोस जुनियोर (पोर्तुगीज: Neymar da Silva Santos Júnior;  ५ फेब्रुवारी १९९२) हा एक ब्राझीलियन फुटबॉलपटू आहे.त्याने 2016च्या उन्हाळी ऑलिम्पिक सामन्यांत सुवर्ण पदक मिळवले ब्राझील फुटबॉल संघाचा विद्यमान खेळाडू असलेला नेयमार २०१४ पासून FRANCEपीएसजी ह्या क्लबासाठी खेळत आहे. २०११ साली वयाच्या १९ व्या वर्षी दक्षिण अमेरिकेमधील सर्वोत्तम फुटबॉल खेळाडू हा पुरस्कार मिळवलेल्या नेयमारने हा पुरस्कार २०१२ साली पुन्हा जिंकला. त्याचा धावण्याचा वेग व बॉलवरील नियंत्रण इत्यादींबाबतीत त्याची तुलना पेलेसोबत केली जाते. अनेक माजी फुटबॉल खेळाडू व तज्ञांच्या मते नेयमार हा जगातील सर्वोत्तम फुटबॉल खेळाडूंपैकी एक आहे.२०१३ सालच्या फिफा कॉन्फेडरेशन्स चषक स्पर्धेमधील विजयामध्ये नेयमारचा मोठा सहभाग होता. ह्या स्पर्धेमध्ये त्याला सर्वोत्तम खेळाडू ठरवण्यात आले व गोल्डन बॉल देण्यात आला.,Category:1992 births|Category:2011 Copa América players|Category:2013 FIFA Confederations Cup players|Category:2014 FIFA World Cup players|Category:2015 Copa América players|Category:2018 FIFA World Cup players|Category:2021 Copa América players|Category:2022 FIFA World Cup players|Category:21st-century Brazilian sportsmen|Category:Afro-Brazilian sportspeople|Category:Al Hilal SFC players|Category:All articles with dead external links|Category:Articles using Template:Medal with Runner-up|Category:Articles using Template:Medal with Winner|Category:Articles with Portuguese-language sources (pt)|Category:Articles with dead external links from September 2023|Category:Articles with permanently dead external links|Category:Articles with short description|Category:Associação Atlética Portuguesa (Santos) players|Category:Brazil men's international footballers|Category:Brazil men's under-20 international footballers|Category:Brazil men's youth international footballers|Category:Brazilian Christians|Category:Brazilian expatriate men's footballers|Category:Brazilian expatriate sportspeople in France|Category:Brazilian expatriate sportspeople in Saudi Arabia|Category:Brazilian expatriate sportspeople in Spain|Category:Brazilian men's footballers|Category:CS1 Brazilian Portuguese-language sources (pt-br)|Category:CS1 French-language sources (fr)|Category:CS1 German-language sources (de)|Category:CS1 Italian-language sources (it)|Category:CS1 Korean-language sources (ko)|Category:CS1 Portuguese-language sources (pt)|Category:CS1 Spanish-language sources (es)|Category:CS1 errors: bare URL|Category:CS1 errors: missing title|Category:CS1 errors: periodical ignored|Category:CS1 maint: numeric names: authors list|Category:CS1 maint: url-status|Category:Campeonato Brasileiro Série A players|Category:Copa Libertadores top scorers|Category:Copa Libertadores–winning players|Category:EngvarB from May 2019|Category:Expatriate men's footballers in France|Category:Expatriate men's footballers in Saudi Arabia|Category:Expatriate men's footballers in Spain|Category:FC Barcelona players|Category:FIFA Confederations Cup–winning players|Category:FIFA Men's Century Club|Category:Footballers at the 2012 Summer Olympics|Category:Footballers at the 2016 Summer Olympics|Category:Footballers from Mogi das Cruzes|Category:La Liga players|Category:Ligue 1 players|Category:Living people|Category:Medalists at the 2012 Summer Olympics|Category:Medalists at the 2016 Summer Olympics|Category:Men's association football forwards|Category:Men's association football wingers|Category:Neymar|Category:Olympic footballers for Brazil|Category:Olympic gold medalists for Brazil|Category:Olympic medalists in football|Category:Olympic silver medalists for Brazil|Category:Pages including recorded pronunciations|Category:Pages using Sister project links with wikidata namespace mismatch|Category:Pages using national squad without sport or team link|Category:Pages using the Phonos extension|Category:Pages with Brazilian Portuguese IPA|Category:Paris Saint-Germain FC players|Category:Santos FC players|Category:Short description is different from Wikidata|Category:São Paulo state football team players|Category:UEFA Champions League top scorers|Category:UEFA Champions League–winning players|Category:Use dmy dates from May 2024|Category:Webarchive template wayback links|Category:Wikipedia indefinitely move-protected pages|Category:Wikipedia indefinitely semi-protected biographies of living people,Neymar,mr,https://mr.wikipedia.org/wiki/%E0%A4%A8%E0%A5%87%E0%A4%AF%E0%A4%AE%E0%A4%BE%E0%A4%B0
80,शिन्झो आबे (जपानी: 安倍 晋三; २१ सप्टेंबर १९५४ - ८ जुलै २०२२) हे एक जपानी राजकारणी होते त्यांनी २००६ ते २००७ आणि पुन्हा २०१२ ते २०२० पर्यंत जपानचे पंतप्रधान आणि लिबरल डेमोक्रॅटिक पक्षाचे अध्यक्ष म्हणून काम केले. जपानच्या इतिहासात ते सर्वात जास्त काळ पंतप्रधान राहिले. इ.स. २०२०चा पद्मविभूषण पुरस्कार दिनांक ८ नोव्हेंबर २०२१ रोजी भारताचे राष्ट्रपती रामनाथ कोविंद यांच्या हस्ते प्रदान करण्यात आला.,Category:1954 births|Category:2022 deaths|Category:2022 murders in Japan|Category:21st-century prime ministers of Japan|Category:All Wikipedia articles written in American English|Category:All articles with unsourced statements|Category:Articles containing French-language text|Category:Articles containing German-language text|Category:Articles containing Italian-language text|Category:Articles containing Japanese-language text|Category:Articles containing video clips|Category:Articles with hAudio microformats|Category:Articles with short description|Category:Articles with unsourced statements from February 2024|Category:Articles with unsourced statements from September 2021|Category:Articles with unsourced statements from September 2023|Category:Assassinated national legislators|Category:Assassinated prime ministers of Japan|Category:CS1: unfit URL|Category:CS1 Chinese-language sources (zh)|Category:CS1 Japanese-language sources (ja)|Category:CS1 Spanish-language sources (es)|Category:CS1 interwiki-linked names|Category:CS1 maint: numeric names: authors list|Category:CS1 uses Japanese-language script (ja)|Category:Chief Commanders of the Legion of Merit|Category:Conservatism in Japan|Category:Deaths by firearm in Japan|Category:Deaths by homemade firearm|Category:Grand Collars of the Order of Lakandula|Category:Grand Crosses of the Order of the Liberator General San Martin|Category:Honorary companions of the Order of Australia|Category:Japanese anti-communists|Category:Japanese nationalists|Category:Japanese politicians with disabilities|Category:Knights Grand Cross of the Order of Isabella the Catholic|Category:Knights Grand Cross of the Order of Orange-Nassau|Category:Liberal Democratic Party (Japan) politicians|Category:Liberal Democratic Party prime ministers of Japan|Category:Members of Nippon Kaigi|Category:Members of the House of Representatives (Japan) 1993–1996|Category:Members of the House of Representatives (Japan) 1996–2000|Category:Members of the House of Representatives (Japan) 2000–2003|Category:Members of the House of Representatives (Japan) 2003–2005|Category:Members of the House of Representatives (Japan) 2005–2009|Category:Members of the House of Representatives (Japan) 2009–2012|Category:Members of the House of Representatives (Japan) 2012–2014|Category:Members of the House of Representatives (Japan) 2014–2017|Category:Members of the House of Representatives (Japan) 2017–2021|Category:Members of the House of Representatives (Japan) 2021–2024|Category:Pages using multiple image with auto scaled images|Category:Pages with Japanese IPA|Category:People appearing on C-SPAN|Category:People from Shinjuku|Category:People murdered in Japan|Category:People with ulcerative colitis|Category:Politicians assassinated in 2022|Category:Politicians with Unification Church|Category:Presidents of the Liberal Democratic Party (Japan)|Category:Recipients of the Olympic Order|Category:Recipients of the Padma Vibhushan in public affairs|Category:Satō–Kishi–Abe family|Category:Seikei University alumni|Category:Shinzo Abe|Category:Short description is different from Wikidata|Category:USC Sol Price School of Public Policy alumni|Category:University of Southern California alumni|Category:Use American English from October 2024|Category:Use dmy dates from September 2023|Category:Webarchive template other archives|Category:Webarchive template wayback links,Shinzō Abe,mr,https://mr.wikipedia.org/wiki/%E0%A4%B6%E0%A4%BF%E0%A4%A8%E0%A5%8D%E0%A4%9C%E0%A5%8B_%E0%A4%86%E0%A4%AC%E0%A5%87
