,mr_intro,en_categories,title,language,link
46,"महमूद अहमदिनेजाद (फारसी: محمود احمدی‌نژاد ; रोमन लिपी: Mahmoud Ahmadinejad) (२८ ऑक्टोबर, इ.स. १९५६ - हयात) हे इराणमधील राजकारणी असून इ.स. २००५-२०१३ या कालखंडात राष्ट्राध्यक्षपदी होते. अहमदिनेजाद इ.स. २००५ साली सत्तेवर आले व जून २००९ मधील वादग्रस्त अध्यक्षीय निवडणूक जिंकल्यानंतर ते पुढील ४ वर्षे राष्ट्राध्यक्षपदावर राहिले. जून, इ.स. २०१३ मध्ये झालेल्या निवडणुकीत हसन रूहानी नवे राष्ट्राध्यक्ष म्हणून निवडून आले.सुरुवातीच्या काळात इंजिनियर व शिक्षक म्हणून काम केलेल्या अहमदिनेजादांनी इ.स. १९७९ च्या इराणी क्रांतीनंतर दफ्तर-ए-तेहकिम-ए-वाहदात (अर्थ : ऐक्यवर्धनाचे कार्यालय) या विद्यार्थी संघटनेत सामील झाले. इ.स. १९९३-१९९५ या कालखंडात ते अर्दाबिल प्रांताचे गव्हर्नर होते. मात्र मोहम्मद खातामी राष्ट्राध्यक्ष झाल्यावर गव्हर्नरपदावरून त्यांची उचलबांगडी झाली व ते पुनश्च अध्यापनाकडे वळले. तेहरानाच्या नगरपरिषदेने इ.स. २००३ साली त्यांची तेहरानाच्या महापौरपदासाठी निवड केली. तेहरानाच्या महापौर कारकिर्दीपासून त्यांनी आणखी धर्मनिष्ठ विचारसरणी पुरस्कारण्यास सुरुवात केली. इ.स. २००५ च्या अध्यक्षीय निवडणुकीस ते उभे राहिले असता, अबदगारान- अर्थात इस्लामी इराण निर्मात्यांची आघाडी - या राजकीय आघाडीने त्यांना पाठिंबा दिला. या निवडणुकांमध्ये ६२% मते मिळवत ते विजयी झाले आणि ३ ऑगस्ट, इ.स. २००५ रोजी त्यांनी राष्ट्राध्यक्षपदाची सूत्रे हाती घेतली.",Category:1956 births|Category:9/11 conspiracy theorists|Category:Academic staff of Iran University of Science and Technology|Category:All articles with failed verification|Category:All articles with unsourced statements|Category:Alliance of Builders of Islamic Iran politicians|Category:Anti-Americanism|Category:Anti-Zionism in Iran|Category:Antisemitism in Iran|Category:Articles containing Persian-language text|Category:Articles with Spanish-language sources (es)|Category:Articles with failed verification from October 2010|Category:Articles with hCards|Category:Articles with short description|Category:Articles with unsourced statements from April 2021|Category:Articles with unsourced statements from August 2019|Category:Articles with unsourced statements from January 2017|Category:Articles with unsourced statements from January 2020|Category:Articles with unsourced statements from July 2017|Category:Articles with unsourced statements from November 2019|Category:Articles with unsourced statements from September 2023|Category:CS1: unfit URL|Category:CS1 Persian-language sources (fa)|Category:CS1 maint: archived copy as title|Category:CS1 maint: bot: original URL status unknown|Category:CS1 uses Persian-language script (fa)|Category:Far-right politics in Iran|Category:Governors of Ardabil province|Category:Guardian topic template using Wikidata|Category:Iran University of Science and Technology alumni|Category:Iranian Holocaust deniers|Category:Iranian Qutbists|Category:Iranian campaign managers|Category:Iranian civil engineers|Category:Iranian far-right politicians|Category:Iranian individuals subject to U.S. Department of the Treasury sanctions|Category:Islamic Revolutionary Guard Corps personnel of the Iran–Iraq War|Category:Islamic Society of Engineers politicians|Category:Living people|Category:Mahmoud Ahmadinejad|Category:Mayors of Tehran|Category:Members of the Expediency Discernment Council|Category:Office for Strengthening Unity members|Category:Pages including recorded pronunciations|Category:Pages using Sister project links with wikidata namespace mismatch|Category:Pages using the Phonos extension|Category:Pages with Persian IPA|Category:Pages with plain IPA|Category:People appearing on C-SPAN|Category:People from Semnan province|Category:Populism in Iran|Category:Presidents of Iran|Category:Right-wing populism in Iran|Category:Secretaries-general of the Non-Aligned Movement|Category:Short description is different from Wikidata|Category:Society of Devotees of the Islamic Revolution politicians|Category:Telegram username not in Wikidata|Category:Transport engineers|Category:Use dmy dates from July 2024|Category:Webarchive template wayback links|Category:Wikipedia indefinitely move-protected pages,Mahmoud Ahmadinejad,mr,https://mr.wikipedia.org/wiki/%E0%A4%AE%E0%A4%B9%E0%A4%AE%E0%A5%82%E0%A4%A6_%E0%A4%85%E0%A4%B9%E0%A4%AE%E0%A4%A6%E0%A4%BF%E0%A4%A8%E0%A5%87%E0%A4%9C%E0%A4%BE%E0%A4%A6
47,"आँग सान सू क्यी (जन्म जून १९ १९४५, रंगून - हयात) ह्या  म्यानमार  देशाच्या निर्वाचित पंतप्रधान, नॅशनल लीग फॉर डेमॉक्रसी पक्षाच्या अध्यक्षा व बर्मामधील लोकशाहीवादी चळवळीच्या कार्यरत नेत्या आहेत. त्यांनी आपल्या देशात लोकशाहीव्यवस्था आणण्यासाठी लष्करी राजवटीविरुद्ध सुमारे 25 वर्षे संघर्ष केला. म्यानमारच्या विरोधी पक्षनेत्या म्हणून त्यांनी ९ जून २०१२ रोजी पहिल्यांदा संसदेत पाऊल ठेवले.लष्करी राजवटीविरुद्ध केलेल्या आंदोलनामुळे स्यू की यांना अनेक वर्षे तुरुंगात काढावी लागली. ब्रम्हदेशाचा लष्कर प्रमुख ने विन याने त्यांना तीन वेळा स्थानबद्धतेमध्ये ठेवले होते.  सू क्यी ह्यांना १९९१ साली नोबेल शांतता पुरस्कार बहाल करण्यात आला. त्यांना १९९२ साली भारत सरकारने त्यांनी म्यानमारमधील लष्करी जुलूमशाही राजवटीविरुद्ध चालवलेल्या अहिंसा चळवळीसाठी त्यांना जवाहरलाल नेहरु शांतता पुरस्कार देऊन गौरवले.त्यांचे नाव तीन वेगवेगळ्या नावांच्या आधारावर आहे, आँग सान हे वडिलांकडून, क्यी हे आईकडून तर सू हे आजीच्या नावातून आले आहे. त्यांच्या पतीचे नांव मायकेल असून मुलांचे नांव अलेक्झांडर आणि किम असे आहे.","Category:1945 births|Category:20th-century Burmese women writers|Category:20th-century Burmese writers|Category:21st-century Burmese politicians|Category:21st-century Burmese women politicians|Category:21st-century Burmese women writers|Category:21st-century Burmese writers|Category:21st-century women prime ministers|Category:Activists from Yangon|Category:All articles with dead external links|Category:Alumni of SOAS University of London|Category:Alumni of St Hugh's College, Oxford|Category:Amnesty International prisoners of conscience held by Myanmar|Category:Articles containing Burmese-language text|Category:Articles with Open Library links|Category:Articles with dead external links from December 2023|Category:Articles with dead external links from January 2023|Category:Articles with dead external links from November 2024|Category:Articles with dead external links from October 2022|Category:Articles with dead external links from October 2023|Category:Articles with dead external links from September 2023|Category:Articles with hAudio microformats|Category:Articles with permanently dead external links|Category:Articles with short description|Category:Aung San Suu Kyi|Category:Buddhist pacifists|Category:Burmese Nobel laureates|Category:Burmese Theravada Buddhists|Category:Burmese activists|Category:Burmese democracy activists|Category:Burmese human rights activists|Category:Burmese pacifists|Category:Burmese prisoners and detainees|Category:Burmese revolutionaries|Category:Burmese socialists|Category:Burmese women activists|Category:Burmese women diplomats|Category:Burmese women in politics|Category:CS1: unfit URL|Category:CS1 Dutch-language sources (nl)|Category:CS1 French-language sources (fr)|Category:CS1 Italian-language sources (it)|Category:Civil rights activists|Category:Congressional Gold Medal recipients|Category:Family of Aung San|Category:Fellows of St Hugh's College, Oxford|Category:Fellows of the Royal College of Surgeons of Edinburgh|Category:Female foreign ministers|Category:Female heads of government|Category:Foreign ministers of Myanmar|Category:Gandhians|Category:Guardian topic template using Wikidata|Category:Heads of government who were later imprisoned|Category:Honorary companions of the Order of Australia|Category:International Simón Bolívar Prize recipients|Category:Lady Shri Ram College alumni|Category:Leaders ousted by a coup|Category:Living people|Category:Members of Pyithu Hluttaw|Category:National League for Democracy politicians|Category:New York Times topic template using Wikidata|Category:Nobel Peace Prize laureates|Category:Nobelprize template using Wikidata property P8024|Category:Nonviolence advocates|Category:Olof Palme Prize laureates|Category:Pages including recorded pronunciations|Category:Pages using Sister project links with hidden wikidata|Category:Pages using Sister project links with wikidata namespace mismatch|Category:Pages using gadget WikiMiniAtlas|Category:Pages using the Phonos extension|Category:Pages with Burmese IPA|Category:Pages with missing ISBNs|Category:People appearing on C-SPAN|Category:People stripped of honorary degrees|Category:Politicians from Yangon|Category:Presidential Medal of Freedom recipients|Category:Prime ministers of Myanmar|Category:Prisoners and detainees of Myanmar|Category:Sakharov Prize laureates|Category:Short description is different from Wikidata|Category:The Elders (organization)|Category:Use British English from December 2024|Category:Use dmy dates from December 2024|Category:Webarchive template wayback links|Category:Wikipedia indefinitely move-protected pages|Category:Wikipedia pending changes protected pages|Category:Women Nobel laureates|Category:Women civil rights activists|Category:Women government ministers of Myanmar|Category:Women opposition leaders",Aung San Suu Kyi,mr,https://mr.wikipedia.org/wiki/%E0%A4%86%E0%A4%81%E0%A4%97_%E0%A4%B8%E0%A4%BE%E0%A4%A8_%E0%A4%B8%E0%A5%82_%E0%A4%95%E0%A5%8D%E0%A4%AF%E0%A5%80
48,"मिलेना मार्कोव्ना मिला कुनिस (ऑगस्ट १४, इ.स. १९८३:चेर्निव्त्सी, युक्रेन - ) ही अमेरिकन चित्रपटअभिनेत्री आहे. ही मूळची युक्रेनियन असून वयाच्या सातव्या वर्षी आपल्या ज्यू कुटुंबासोबत पळून अमेरिकेला आली.",Category:1983 births|Category:20th-century American Jews|Category:20th-century American actresses|Category:21st-century American Jews|Category:21st-century American actresses|Category:Actors from Chernivtsi|Category:Actresses from Los Angeles|Category:All Wikipedia articles written in American English|Category:American Ashkenazi Jews|Category:American child actresses|Category:American film actresses|Category:American people of Ukrainian-Jewish descent|Category:American television actresses|Category:American video game actresses|Category:American voice actresses|Category:American women television producers|Category:Articles containing Russian-language text|Category:Articles containing Ukrainian-language text|Category:Articles with hCards|Category:Articles with short description|Category:Bukovina Jews|Category:CS1: unfit URL|Category:CS1 Hebrew-language sources (he)|Category:CS1 Ukrainian-language sources (uk)|Category:CS1 uses Ukrainian-language script (uk)|Category:California Democrats|Category:Commons category link is on Wikidata|Category:Good articles|Category:Jewish American actresses|Category:Jewish film people|Category:Living people|Category:Marcello Mastroianni Award winners|Category:Naturalized citizens of the United States|Category:Pages including recorded pronunciations|Category:Pages using the Phonos extension|Category:Pages with Russian IPA|Category:Pages with Ukrainian IPA|Category:Pages with non-numeric formatnum arguments|Category:Short description is different from Wikidata|Category:Soviet emigrants to the United States|Category:TCMDb name template using non-numeric ID from Wikidata|Category:Use American English from January 2023|Category:Use mdy dates from January 2023|Category:Wikipedia indefinitely semi-protected biographies of living people,Mila Kunis,mr,https://mr.wikipedia.org/wiki/%E0%A4%AE%E0%A4%BF%E0%A4%B2%E0%A4%BE_%E0%A4%95%E0%A5%81%E0%A4%A8%E0%A4%BF%E0%A4%B8
49,"डॉ. महंमद युनूस (२८ जून, इ.स. १९४०:चट्टग्राम, बांगलादेश - ) हे बांगलादेशातील ग्रामीण बँकेचे संस्थापक आहेत. सन २००६ मध्ये त्यांना नोबेल पारितोषिकाने सन्मानित करण्यात आले. महंमद युनूस हे बँकर टू द पुअर या ग्रंथाचे लेखक आहेत.आईवडिलांच्या नऊ अपत्यापैकी तिसरे अपत्य असलेल्या युनुस ह्यांनी अर्थशास्त्र ह्या विषयात ढाका विद्यापीठातून बी.ए.आणि एम.ए.केले.काही वर्षे ढाका विद्यापीठात अध्यापन केले.फुलब्राईट शिष्यवृत्तीद्वारे व्हंडरबिल्ट युनिव्हर्सिटीतून पीएच.डी.केली. काही काळ तिथे अद्यापन केले.साल १९७२ मध्ये ते चितगाव विद्यापीठाच्या अर्थशास्त्र विभागाचे प्रमुख झाले.ऑगस्ट २०२४मध्ये बांगलादेशमध्ये झालेल्या आंदोलनामुळे पंतप्रधान शेख हसीना यांनी भारतात पळ काढल्यावर युनूस यांनी मुख्य सल्लागार या नात्याने देशाचा कारभार पाहिला.",Category:1940 births|Category:Academic staff of the University of Chittagong|Category:Agriculture and food award winners|Category:All Wikipedia articles written in Bangladeshi English|Category:Articles containing Bengali-language text|Category:Articles with hCards|Category:Articles with short description|Category:Bangladeshi Nobel laureates|Category:Bangladeshi Sunni Muslims|Category:Bangladeshi bankers|Category:Bangladeshi businesspeople|Category:Bangladeshi economists|Category:CS1 Bengali-language sources (bn)|Category:CS1 uses Bengali-language script (bn)|Category:Chittagong College alumni|Category:Chittagong Collegiate School and College alumni|Category:Congressional Gold Medal recipients|Category:Development specialists|Category:Guardian topic template using Wikidata|Category:HuffPost writers and columnists|Category:International Simón Bolívar Prize recipients|Category:Living people|Category:Microfinance people|Category:Middle Tennessee State University faculty|Category:Muhammad Yunus|Category:New York Times topic template using Wikidata|Category:Nobel Peace Prize laureates|Category:Nobelprize template using Wikidata property P8024|Category:Pages using Sister project links with hidden wikidata|Category:Pages with Bengali IPA|Category:People appearing on C-SPAN|Category:People associated with Glasgow Caledonian University|Category:People from Hathazari Upazila|Category:People in international development|Category:Pfeffer Peace Prize laureates|Category:Presidential Medal of Freedom recipients|Category:Prime ministers of Bangladesh|Category:Ramon Magsaysay Award winners|Category:Recipients of the Independence Day Award|Category:Short description is different from Wikidata|Category:Social entrepreneurs|Category:The Elders (organization)|Category:United Nations Foundation|Category:University of Dhaka alumni|Category:Use Bangladeshi English from February 2020|Category:Use dmy dates from August 2024|Category:Vanderbilt University alumni|Category:Wikipedia pages semi-protected against vandalism|Category:Winners of the Nikkei Asia Prize|Category:Yunus interim government advisors,Muhammad Yunus,mr,https://mr.wikipedia.org/wiki/%E0%A4%AE%E0%A5%81%E0%A4%B9%E0%A4%AE%E0%A5%8D%E0%A4%AE%E0%A4%A6_%E0%A4%AF%E0%A5%81%E0%A4%A8%E0%A5%82%E0%A4%B8
50,"सेल्मा लॅगरल्यॉफ (स्वीडिश:  Selma Lagerlöf ; २० नोव्हेंबर, इ.स. १८५८ - १६ मार्च, इ.स. १९४०) ही एक स्वीडिश लेखिका होती. १९०९ साली साहित्यातील नोबेल पुरस्कार मिळवणारी ती पहिली महिला साहित्यिक होती.",Category:1858 births|Category:1940 deaths|Category:19th-century Swedish novelists|Category:20th-century Swedish novelists|Category:All articles with dead external links|Category:All articles with unsourced statements|Category:Articles containing Swedish-language text|Category:Articles with Internet Archive links|Category:Articles with LibriVox links|Category:Articles with Open Library links|Category:Articles with Project Gutenberg links|Category:Articles with Swedish-language sources (sv)|Category:Articles with dead external links from September 2022|Category:Articles with short description|Category:Articles with unsourced statements from December 2020|Category:CS1 Swedish-language sources (sv)|Category:Commons link is on Wikidata|Category:Liberals (Sweden) politicians|Category:Litteris et Artibus recipients|Category:Lutheran pacifists|Category:Lutheran writers|Category:Members of the Swedish Academy|Category:Nobel laureates in Literature|Category:Nobelprize template using Wikidata property P8024|Category:Open Library ID same as Wikidata|Category:Pages including recorded pronunciations|Category:Pages using the Phonos extension|Category:Pages with Swedish IPA|Category:People from Sunne Municipality|Category:Recipients of the Illis quorum|Category:SKBL template using Wikidata property P4963|Category:Selma Lagerlöf|Category:Short description is different from Wikidata|Category:Swedish-language writers|Category:Swedish Christian pacifists|Category:Swedish Lutherans|Category:Swedish Nobel laureates|Category:Swedish children's writers|Category:Swedish feminists|Category:Swedish short story writers|Category:Swedish suffragists|Category:Swedish women children's writers|Category:Swedish women novelists|Category:Use dmy dates from December 2017|Category:Webarchive template wayback links|Category:Wikipedia articles incorporating a citation from Collier's Encyclopedia|Category:Wikipedia articles incorporating a citation from the 1922 Encyclopaedia Britannica with Wikisource reference|Category:Wikipedia articles incorporating a citation from the Encyclopedia Americana with a Wikisource reference|Category:Wikipedia articles needing clarification from December 2020|Category:Wikipedia articles needing clarification from November 2024|Category:Women Nobel laureates|Category:Writers from Värmland,Selma Lagerlöf,mr,https://mr.wikipedia.org/wiki/%E0%A4%B8%E0%A5%87%E0%A4%B2%E0%A5%8D%E0%A4%AE%E0%A4%BE_%E0%A4%B2%E0%A5%85%E0%A4%97%E0%A4%B0%E0%A4%B2%E0%A5%8D%E0%A4%AF%E0%A5%89%E0%A4%AB
51,सुहार्तो (८ जून १९२१ - २७ जानेवारी २००८) हा इंडोनेशिया देशाचा दुसरा राष्ट्राध्यक्ष होता. १९६७ साली सुकर्णोला राज्यपदावरून हाकलून लावून राष्ट्राध्यक्ष बनलेला सुहार्तो पुढील ३१ वर्षे (१९९८ पर्यंत) ह्या पदावर होता. सुहार्तोच्या राजवटीमध्ये इंडोनेशियाने झपाट्याने प्रगती केली व जनतेचे राहणीमान उंचावले. परंतु सुहार्तोवर हुकुमशाही केल्याची टीका देखील झाली.,Category:1921 births|Category:2008 deaths|Category:All articles with unsourced statements|Category:Articles containing Dutch-language text|Category:Articles containing Indonesian-language text|Category:Articles containing Japanese-language text|Category:Articles with short description|Category:Articles with unsourced statements from May 2018|Category:Articles with unsourced statements from May 2022|Category:CS1 Indonesian-language sources (id)|Category:CS1 maint: url-status|Category:Cendana family|Category:Chiefs of staff of the Indonesian Army|Category:Commanders of the Indonesian National Armed Forces|Category:Commons category link is on Wikidata|Category:Critics of Islamism|Category:Deaths from kidney failure in Indonesia|Category:Deaths from lung disease|Category:Deputy prime ministers of Indonesia|Category:Genocide perpetrators|Category:Golkar politicians|Category:Good articles|Category:Indonesian Sunni Muslims|Category:Indonesian anti-communists|Category:Indonesian generals|Category:Indonesian mass killings of 1965–1966 perpetrators|Category:Indonesian nationalists|Category:Javanese people|Category:Leaders who took power by coup|Category:Members of Pembela Tanah Air|Category:Ministers of defense of Indonesia|Category:New Order (Indonesia)|Category:Pages including recorded pronunciations|Category:Pages using multiple image with auto scaled images|Category:Pages using the Phonos extension|Category:Pages with Indonesian IPA|Category:People from Yogyakarta|Category:People of the Indonesian National Revolution|Category:Perpetrators of Indigenous genocides|Category:Political corruption|Category:Presidents of Indonesia|Category:Recipients of the Grand Order of Mugunghwa|Category:Recipients of the Order of Al-Hussein bin Ali|Category:Royal Netherlands East Indies Army personnel|Category:Secretaries-general of the Non-Aligned Movement|Category:Short description is different from Wikidata|Category:Suharto|Category:Use dmy dates from February 2024|Category:Webarchive template wayback links|Category:Wikipedia articles needing clarification from April 2014|Category:Wikipedia articles needing page number citations from March 2021,Suharto,mr,https://mr.wikipedia.org/wiki/%E0%A4%B8%E0%A5%81%E0%A4%B9%E0%A4%BE%E0%A4%B0%E0%A5%8D%E0%A4%A4%E0%A5%8B
